,id,keyword,location,text,target
31,48,ablaze,birmingham,bbcmtd wholesale markets ablaze,1
32,49,ablaze,est. september 2012 - bristol,always try bring heavy metal rt,0
33,50,ablaze,africa,africanbaze breaking newsnigeria flag set ablaze aba,1
34,52,ablaze,"philadelphia, pa",crying set ablaze,0
35,53,ablaze,"london, uk",plus side look sky last night ablaze,0
36,54,ablaze,pretoria,phdsquares mufc theyve built much hype around new acquisitions doubt set epl ablaze season,0
37,55,ablaze,world wide!!,inec office abia set ablaze,1
38,56,ablaze,,barbados bridgetown jamaica ûò two cars set ablaze santa cruz ûó head st elizabeth police superintende,1
39,57,ablaze,paranaque city,ablaze lord,0
40,59,ablaze,live on webcam,check,0
41,61,ablaze,,outside youre ablaze alive youre dead inside,0
42,62,ablaze,milky way,awesome time visiting cfc head office ancop site ablaze thanks tita vida taking care us,0
43,63,ablaze,,soooo pumped ablaze southridgelife,0
44,64,ablaze,,wanted set chicago ablaze preaching hotel,0
45,65,ablaze,,gained 3 followers last week know stats grow,0
46,66,ablaze,"greensboro,north carolina",west burned thousands wildfires ablaze california alone,1
47,67,ablaze,,building perfect tracklist life leave streets ablaze,0
48,68,ablaze,live on webcam,check,0
49,71,ablaze,england.,first night retainers quite weird better get used wear every single night next year least,0
50,73,ablaze,"sheffield township, ohio",deputies man shot brighton home set ablaze,1
51,74,ablaze,india,man wife get six years jail setting ablaze niece,1
52,76,ablaze,barbados,santa cruz ûó head st elizabeth police superintendent lanford salmon r,0
53,77,ablaze,anaheim,police arsonist deliberately set black church north carolinaåêablaze,1
54,78,ablaze,abuja,noches elbestia alexissanchez happy see teammates training hard goodnight gunners,0
55,79,ablaze,usa,kurds trampling turkmen flag later set ablaze others vandalized offices turkmen front diyala,1
56,80,ablaze,south africa,truck ablaze r21 voortrekker ave outside tambo intl cargo section,1
57,81,ablaze,"sao paulo, brazil",set hearts ablaze every city gift every skyline like kiss upon lips û,0
58,82,ablaze,hollywoodland ,sky ablaze tonight los angeles im expecting ig fb filled sunset shots know peeps,0
59,83,ablaze,"edmonton, alberta - treaty 6",west burned thousands wildfires ablaze california alone,1
60,85,ablaze,,revel wmv videos means mac farewell ablaze wmv en route dvd gtxrwm,0
61,86,ablaze,inang pamantasan,progressive greetings month students would set pens ablaze torch publications,0
62,89,ablaze,twitter lockout in progress,rene ablaze amp jacinta secret 2k13 fallen skies edit mar 30 2013,0
63,91,ablaze,"concord, ca",navista7 steve fires something else california tinderbox clown setting hood ablaze news24680,1
64,92,ablaze,"calgary, ab",nowplaying rene ablaze amp ian buff magnitude,0
65,93,ablaze,birmingham,nxwestmidlands huge fire wholesale markets ablaze,1
66,95,ablaze,san francisco,ablaze time talk go dont know make due work,0
67,96,accident,clvlnd,cant kids cuz got bicycle accident amp split testicles impossible kids michael father,0
68,97,accident,"nashville, tn",accident i24 w nashvilletraffic traffic moving 8m slower usual,1
69,98,accident,"santa clara, ca",accident center lane blocked santaclara us101 nb great america pkwy bayarea traffic,1
70,100,accident,uk,,0
71,102,accident,"st. louis, mo",stlouis caraccidentlawyer speeding among top causes teen accidents,0
72,104,accident,"walker county, alabama",reported motor vehicle accident curry herman rd near stephenson involving overturned vehicle please use,1
73,105,accident,australia,bigrigradio live accident awareness,1
74,107,accident,north carolina,i77 mile marker 31 south mooresville iredell vehicle accident ramp closed 86 118 pm,1
75,109,accident,,rt sleepjunkies sleeping pills double risk car accident,0
76,110,accident,norf carolina,accident knew gon happen,0
77,112,accident,"san mateo county, ca",traffic accident n cabrillo hwymagellan av mir 080615 110358,1
78,113,accident,north carolina,i77 mile marker 31 40 south mooresville iredell vehicle accident congestion 86 118 pm,1
79,114,accident,"njoro, kenya",pastor scene accidentwho owner range rover,1
80,117,accident,,mom didnt get home fast wished mom accident truck spilt mayonnaise,0
81,118,accident,your sister's bedroom,horrible car accident past sunday im finally able get around thank god,1
82,119,accident,,wait see pissed donnie tell another accident,0
83,120,accident,"arlington, tx",truckcrash overturns fortworth interstate,1
84,121,accident,"south bloomfield, oh",accident ashville us 23 sb sr 752 traffic,1
85,126,accident,,carolina accident motorcyclist dies i540 crash car crossed median motorcycle rider traveling,1
86,128,accident,"new hanover county, nc",fyi cadfyi accident property damagenhs999 piner rdhorndale dr,1
87,129,accident,maldives,rt naayf first accident years turning onto chandanee magu near mma taxi rammed halfway turned everyone confû,1
88,130,accident,"manchester, nh",accident left lane blocked manchester rt 293 nb eddy rd stop go traffic back nh3a delay 4 mins traffic,1
89,131,accident,"wilmington, nc",accident property damage piner rdhorndale dr,1
90,132,accident,,accident,0
91,133,accident,"new hanover county, nc",fyi cadfyi accident property damagewpd1600 17th st,1
92,134,accident,,862015209 pm traffic accident injury 2781 willis foreman rd,1
93,135,accident,global,aashiqui actress anu aggarwal nearfatal accident,1
94,136,accident,alberta | sask. | montana,suffield alberta accident,1
95,137,accident,charlotte,9 mile backup i77 southaccident blocking right 2 lanes exit 31 langtree rdconsider nc 115 nc 150 nc 16 alternate,1
96,138,accident,"baton rouge, la",accident changed life help determine options financially support life care plans ongoing treatment,0
97,139,accident,"hagerstown, md",breaking deadly motorcycle car accident happened hagerstown today ill details 5 your4state whag,1
98,141,accident,"gloucestershire , uk",flowri marinading accident,0
99,143,accident,,car even week got fucking car accident mfs cant fucking drive,1
100,144,accident,uk,norwaymfa bahrain police previously died road accident killed explosion,1
101,145,accident,"nairobi, kenya",still heard church leaders kenya coming forward comment accident issue disciplinary measuresarrestpastornganga,0
102,146,aftershock,instagram - @heyimginog ,aftershockdelo scuf ps live game cya,0
103,149,aftershock,304,man drive effort gets painful man win roger bannister,0
104,151,aftershock,switzerland,320 ir icemoon aftershock,0
105,153,aftershock,304,victory bargain basement prices dwight david eisenhower,0
106,156,aftershock,us,320 ir icemoon aftershock,0
107,157,aftershock,304,nobody remembers came second charles schulz,0
108,158,aftershock,instagram - @heyimginog ,aftershockdelo im speaking someone using scuf xb1 people end getting ps also,0
109,159,aftershock,304,harder conflict glorious triumph thomas paine,0
110,160,aftershock,,growingupspoiled going clay pigeon shooting crying aftershock,0
111,161,aftershock,somewhere only we know ?,guess one actually wants free aftershock tc,0
112,162,aftershock,,aftershock terrifying best roller coaster ive ever disclaimer ive,0
113,163,aftershock,belgium,aftershock,0
114,164,aftershock,switzerland,320 ir icemoon aftershock,0
115,165,aftershock,us,320 ir icemoon aftershock,0
116,168,aftershock,,320 ir icemoon aftershock,0
117,170,aftershock,dope show,kjfordays im seeing issues aftershock,0
118,171,aftershock,switzerland,320 ir icemoon aftershock,0
119,172,aftershock,switzerland,320 ir icemoon aftershock,0
120,173,aftershock,"oshawa, canada",wisdomwed bonus 5 minute daily habits could really improve life many already lifehacks,0
121,174,aftershock,baker city oregon,aftershock protect profit next global financial meltdown david wiedemer http,0
122,175,aftershock,,moment get scary roller coaster guy behind screaming bloody murder silverwood aftershock,0
123,176,aftershock,,aftershock ã¢ 2010 fullã¢ streaming youtube,0
124,178,aftershock,united states,gtgt 15 aftershock protect profit next global financial book,0
125,180,aftershock,304,sometimes face difficulties youre something wrong youre something right joel osteen,0
126,182,aftershock,304,thing stands dream try belief actually possible joel brown,0
127,183,aftershock,marysville ca ,praise god ministry tells like wdyouth biblestudy,0
128,184,aftershock,304,remembering going die best way know avoid trap thinking something lose ûò steve jobs,0
129,185,aftershock,"hermosa beach, ca",tried orange aftershock today life never,0
130,187,aftershock,,onfireanders love bb,0
131,190,aftershock,,aftershock,0
132,191,aftershock,,aftershock back school kick great want thank everyone making possible great night,0
133,193,aftershock,304,people say cannot done interrupt ûò george bernard shaw,0
134,194,aftershock,304,first man gets oyster second man gets shell andrew carnegie,0
135,195,aftershock,,anyone need pu tonight play hybrid slayer ps4 eu hmu cod8sandscrims empirikgaming codawscrims 4tpkotc 4tpfa aftershockorg,0
136,196,airplane accident,"19.600858, -99.047821",experts france begin examining airplane debris found reunion island french air accident experts,1
137,197,airplane accident,pennsylvania,strict liability context airplane accident pilot error common component aviation cr,1
138,198,airplane accident,"salt lake city, utah",crobscarla lifetime odds dying airplane accident 1 8015,0
139,199,airplane accident,"palo alto, ca",experts france begin examining airplane debris found reunion island french air accident experts wedn,1
140,201,airplane accident,,alexalltimelow awwww theyre airplane accident theyre gonna die cuties good job,1
141,203,airplane accident,"spain but opa-locka, fl",family members osama bin laden died airplane accident ironic mhmmm gov shit suspect,1
142,204,airplane accident,"jaipur, india",man goes airplane engine accident,1
143,205,airplane accident,hyderabad telangana india,horrible accident man died wings airplane 29072015,1
144,208,airplane accident,"eagle pass, texas",cessna airplane accident ocampo coahuila mexico july 29 2015 killed four men including state coahuila government official,1
145,209,airplane accident,bangalore,horrible accident man died wings airplane 29072015 watchthevideo,1
146,210,airplane accident,financial news and views,experts france begin examining airplane debris found reunion island,1
147,211,airplane accident,,experts france begin examining airplane debris found reunion island french air accident experts wednesday began examining,1
148,212,airplane accident,indonesia,kca votejkt48id mbataweel rip binladen family members killed airplanes accident,1
149,213,airplane accident,y(our) boyfriends legs ,almost sent coworker nudes accident thank god airplane mode,0
150,215,airplane accident,"new mexico, usa",mickinyman theatlantic might killed airplane accident night car wreck politics best,0
151,216,airplane accident,somewhere out there,experts france begin examining airplane debris found reunion island french air accident experts,1
152,218,airplane accident,,unbelievably insane man airport airplane aircraft aeroplane runway accident freakyû,1
153,219,airplane accident,mumbai india,horrible accident man died wings airplaneåê29072015,1
154,220,airplane accident,sri lanka,horrible accident man died wings airplane 29072015,1
155,221,airplane accident,not a u.s resident,usama bin ladins family dead airplane crash naturally accident,1
156,222,airplane accident,,pilot dies plane crash car festival,1
157,225,airplane accident,"lehigh valley, pa",strict liability context airplane accident,1
158,226,airplane accident,canada,dtn brazil experts france begin examining airplane debris found reunion island french air accident exp,1
159,229,airplane accident,,experts france begin examining airplane debris found reunion island french air accident experts wedn,1
160,231,airplane accident,thrissur,horrible accident man died wings ûïairplaneû 29072015 wtf canûªt believe eyes ûò,1
161,232,airplane accident,havenford,nicole fletcher one victim crashed airplane times ago accident left little bit trauma although shes,1
162,235,airplane accident,india,omg horrible accident man died wings airplane,1
163,237,airplane accident,92,omg dont believe rip bro airplane accident jetengine turbojet boing g90,1
164,238,airplane accident,,experts france begin examining airplane debris found reunion island french air accident experts wednesday began examining,1
165,240,airplane accident,israel,airplane accident,1
166,241,airplane accident,fashion heaven. ig: tmid_,phone looks like car ship airplane accident terrible,0
167,242,airplane accident,"san francisco, ca",statistically im risk getting killed cop dying airplane accident,0
168,243,airplane accident,italy,airplane crashes house colombia 12 people die accident,1
169,244,airplane accident,nyc,shooting airplane accident,1
170,245,airplane accident,toronto,could drone cause airplane accident pilots worried use drones esp close vicinity airports,1
171,246,ambulance,,early wake call sister begging come amp ride wher ambulance hospital rodkiai,1
172,247,ambulance,jackson,,1
173,248,ambulance,new york / worldwide,two air ambulances scene serious crash two cars lorry,1
174,249,ambulance,,twelve feared killed pakistani air ambulance helicopter crash reuters,1
175,251,ambulance,"new orleans, la",leading emergency services boss welcomes new ambulance charity,0
176,252,ambulance,west wales,anyone travelling aberystwythshrewsbury right theres incident services halt outside shrews ambulance scene,1
177,253,ambulance,,twelve feared killed pakistani air ambulance helicopter crash,1
178,254,ambulance,happily married with 2 kids ,ambulance sprinter automatic frontline vehicle choice 14 lez compliant ebay,0
179,256,ambulance,"cambridge, ma",new nanotech device able target destroy blood clots,0
180,258,ambulance,arizona ,20skyhawkmm20 traplord29 fredosantana300 lilreese300 hella crazy 3 fights ambulance couple mosh pits,1
181,260,ambulance,mumbai,get run ambulance lucky justsaying randomthought,0
182,261,ambulance,,news twelve feared killed pakistani air ambulance helicopter crash,1
183,262,ambulance,amsterdam,,1
184,263,ambulance,"swindon,england ",tanslash waiting ambulance,0
185,264,ambulance,,fouseytube ok need ambulance hahahah good,0
186,265,ambulance,happily married with 2 kids ,ambulance sprinter automatic frontline vehicle choice 14 lez compliant ebay,0
187,266,ambulance,,pakistan air ambulance helicopter crash kills nine,1
188,267,ambulance,"williamstown, vt",thenissonian rejectdcartoons nissan ok need medical assistance call ambulance need,0
189,268,ambulance,"north carolina, usa",ems1 ny emts petition 17 per hour û÷minimum wageûª,0
190,269,ambulance,,,1
191,270,ambulance,karachi,twelve feared killed pakistani air ambulance helicopter crash,1
192,271,ambulance,happily married with 2 kids ,ambulance sprinter automatic frontline vehicle choice 14 lez compliant ebay,0
193,272,ambulance,happily married with 2 kids ,ambulance sprinter automatic frontline vehicle choice 14 lez compliant ebay,0
194,273,ambulance,loveland colorado,kiwikaryn check whats parking lot said last year ambulance st johns,0
195,274,ambulance,|| c h i c a g o ||,dont know way ambulance coming ltlt,1
196,276,ambulance,,reuters twelve feared killed pakistani air ambulance helicopter crash,1
197,277,ambulance,l. a.,,1
198,279,ambulance,,ambulance right outside work,0
199,280,ambulance,canada,ûïleoblakecarter dog thinks hes ambulance,0
200,281,ambulance,visit my youtube channel.,happening hatzolah ems ambulance responding dual sirens andû,0
201,283,ambulance,lexington,,1
202,285,ambulance,,,1
203,287,ambulance,usa,twelve feared killed pakistani air ambulance helicopter crash,1
204,289,ambulance,"hannover, germany",twelve feared killed pakistani air ambulance helicopter crash,1
205,290,ambulance,,whats police ambulance number lesotho body know,0
206,291,ambulance,,medic914 aaceorg surprised still cannot standardised clinical practice across 11 nhs ambulance trust,0
207,293,ambulance,playa,,1
208,294,ambulance,"davidson, nc",people try jwalk ambulance passing hate,0
209,296,annihilated,higher places,episode trunks annihilated freiza cleanest shit ever showed nigga mercy,0
210,297,annihilated,"horsemind, mi",shall annihilated petebests dessicated laid bare shall kneel,0
211,298,annihilated,"new york, ny",uribe annihilated baseball mets,0
212,299,annihilated,boksburg,marksmaponyane heysundowns annihilated previous meeting celticindeed improvement,0
213,301,annihilated,,volfan326 tneazzy mizzou annihilated florida past 2 seasons even ended muschamps career cant compete bama,0
214,302,annihilated,,annihilated abs,1
215,303,annihilated,,annihilated status education mba behalf easy street careen eovm,0
216,307,annihilated,"v-rp @ozrp_ ?mv, au, r18+?",luka die everything annihilated alois trancy,0
217,309,annihilated,"greater manchester, uk",acarewornheart good un fella sorry wont get annihilated,0
218,310,annihilated,boston,cop pulls drunk driver safety seconds car hit train,1
219,312,annihilated,,must annihilated,0
220,313,annihilated,,cop pulls drunk driver safety seconds car hit train,1
221,314,annihilated,the canopy kingdom,boom country entirely annihilated hû ûó britain,0
222,315,annihilated,,amirkingkhan would annihilated might well thank floydmayweather,0
223,316,annihilated,usa,one thing suregod promised israel annihilated butthe horror iran wnukes,0
224,318,annihilated,,violentfeminazi guess thats ok armenians since weve spent history getting annihilated,1
225,320,annihilated,,70 years since annihilated 100000 people instantly became aware ability annihilate whole humanity,1
226,321,annihilated,the own zone layer ,day 1 tryouts went good minus fact stopped quickly get short ball annihilated toenail injury even,0
227,322,annihilated,london,1960s oryx symbol arabian peninsula annihilated hunters,1
228,327,annihilated,trancy manor,luka die everything annihilated alois trancy,0
229,328,annihilated,,ready get annihilated bucs game,1
230,329,annihilated,south 37,philipduncan breakfastone people annihilated last nights weather really philip thought would forecast,1
231,330,annihilated,,domain sophistication annihilated closely uptotheminute feat zrnf,0
232,331,annihilated,"west lancashire, uk.",stormbeard steellord seen judas priest 2005 rob came back scorpions support fucking annihilated place astonishing gig,0
233,332,annihilated,pa,officially skipping fantasticfourfant4sticwhatever hashtag getting annihilated reviews bummer,0
234,334,annihilated,,tomcatarts thus explaining annihilated case survivor evolved became godlike,1
235,335,annihilated,û¢ views from the six û¢,completely annihilated cech paul keegan time alive,0
236,336,annihilated,,tomcatarts annihilated legion survivors imperfect hybrid project quickly formed new secret cell,0
237,337,annihilated,university of toronto,sirbrandonknt exactly thats lesnarcena match summerslam last year great brock annihilated guy whos,0
238,338,annihilated,,cop pulls drunk driver safety seconds car hit train,1
239,340,annihilated,swaning around,annihilated damascus syrian army grinds û÷alloosh gang manure pile,1
240,341,annihilated,,thatdes ok wasnt completely forthright may also food coma bc kebabtahinipickles also annihilated wfries,0
241,344,annihilated,london,fun filled happyhour simmons bar camden handsome one got annihilated apart game,0
242,345,annihilated,albany/ny,juanny beisbol sr annihilated ball lgm,0
243,346,annihilation,"california, usa",rvfriedmann hell fraction belief total annihilation destruction usa lodisilverado ritzyjewels,1
244,347,annihilation,,potus maybe call israel tell sorry pres sold river annihilation,0
245,348,annihilation,,evildead annihilation civilization,0
246,349,annihilation,,us national park services tonto national forest stop annihilation salt river wild horse,0
247,352,annihilation,wild wild web,annihilating quarterstaff annihilation,1
248,353,annihilation,subconscious la,world annihilation vs self transformation,0
249,354,annihilation,spain,starmade stardate 3 planetary annihilation,1
250,355,annihilation,,us national park services tonto national forest stop annihilation salt river wild horse,0
251,356,annihilation,ca physically- boston strong?,us national park services tonto national forest stop annihilation salt river wild horse,1
252,358,annihilation,"yeezy taught me , nv",kimkardashian please sign share petition save wild horses arizona,0
253,360,annihilation,,us national park services tonto national forest stop annihilation salt river wild horse,1
254,361,annihilation,ca physically- boston strong?,theellenshow please check salt river horses help stop annihilation happen without 54000 signatureschange org thx,0
255,363,annihilation,united states,souls punished withåêannihilation,0
256,364,annihilation,,calfreedommom steph93065 mention major contributor annihilation israel,1
257,365,annihilation,,willienelson need help horses dieplease rt amp sign petitiontake stand amp voice gilbert23,1
258,368,annihilation,"rock hill, sc",reject laws misguided false prophets imprison nations fueling self annihilation,0
259,370,annihilation,"coolidge, az",us national park services tonto national forest stop annihilation salt river wild horse,0
260,371,annihilation,republic of texas,annihilation jeb christie amp kasich less 24 hours away please god allow least one full day,0
261,372,annihilation,,barbitwins need helphorses die please rt amp sign petition take stand amp voice gilbert23,0
262,375,annihilation,,whippenz need help horses dieplease rt amp sign petitiontake stand amp voice gilbert23,0
263,380,annihilation,"phoenix, az",hey az sign petition save wildhorses tantonationalforest rollingstones singalong order,0
264,381,annihilation,"ljubljana, slovenia",stop annihilation salt river wild horses,1
265,383,annihilation,connecticut,sonofbaldwin hes current nova bookslast checkedhe tied books 2011 rider died annihilation,0
266,384,annihilation,"tacoma,washington",us national park services tonto national forest stop annihilation salt river wild horse,0
267,386,annihilation,,please sign amp rt save saltriverwildhorses,0
268,389,annihilation,,thanks count dante join us following annihilation zone johnny,0
269,390,annihilation,subconscious la,world annihilation vs self transformation,1
270,393,annihilation,big d  houston/boston/denver,us national park services tonto national forest stop annihilation salt river wild horse,0
271,394,annihilation,"chandler, az",us national park services tonto national forest stop annihilation salt river wild horse,1
272,396,apocalypse,colorado,im gonna fight taylor soon get,0
273,397,apocalypse,sindria,ohh fukurodani didnt survive apocalypse bokuto feels horrible poor boy ppor child,1
274,398,apocalypse,,another jocelyn birthday apocalypse,0
275,401,apocalypse,,rt janenelson097 rt stephenscifi adaptation watch charlie humans apocalypse optioned film sciencefiction û,0
276,402,apocalypse,texas,apocalypse please,0
277,404,apocalypse,"elk grove, ca, usa",another hour august 05 2015 0802pm heres red rover zombie apocalypse 2014,1
278,406,apocalypse,texas,honeybunzgem primalkitchen feel like pullup one stages apocalypse,0
279,407,apocalypse,,shes kinda hot played radio today whats next disease apocalypse started everyone careful,0
280,409,apocalypse,the shire,apocalypse lol gf m8,0
281,410,apocalypse,"austin, tx",know question interpretation sign apocalypse called,1
282,412,apocalypse,oakland,julie r apocalypse version romeo juliet warmbodies,0
283,413,apocalypse,,apocalypse upon us,0
284,415,apocalypse,,rt fittscott minecraft night lucky block mod bob apocalypse wither 20 amp mod showcase popularmmos,0
285,418,apocalypse,albuquerque,begins day one snow apocalypse,1
286,419,apocalypse,,rt ourmothermary short reading apocalypse 211023 spirit angel took top enormous high mountain û,0
287,420,apocalypse,"buenos aires, argentina",candylit imagine sarumi zombie apocalypse fighting back back heart heart conversations,0
288,421,apocalypse,,rt zonewolf123 liked youtube video,0
289,423,apocalypse,,thats planet lone audience apocalypse,0
290,424,apocalypse,"san antonio-ish, tx",dad bought dvd looks like science doc front read back actually impending biblical apocalypse,1
291,426,apocalypse,san francisco,alexandrapullin indeed apocalypse comes week know ill,0
292,427,apocalypse,"oregon, usa",go look grizzly peak right looks like beginning dystopian apocalypse movie,0
293,429,apocalypse,"harlingen, tx",niece asked would scared apocalypse,0
294,432,apocalypse,buffalo ny,theres storm cairo latest xmen apocalypse set photo,1
295,435,apocalypse,,minecraft night lucky block mod bob apocalypse wither 20 amp mod showcase popularmmos,0
296,436,apocalypse,,shot heart xv going totally give love bad name heart pierc,0
297,437,apocalypse,,rt geekapocalypse 4pm gmt hesse plays dark souls 2 day 9,0
298,438,apocalypse,las vegas,know go zombies take,0
299,440,apocalypse,,latest bryansinger reveals storm queen apocalypse rupaul alexshipppp,1
300,442,apocalypse,,shadow boxing apocalypse,1
301,443,apocalypse,,short reading apocalypse 211023 spirit angel took top enormous high mountain,1
302,444,apocalypse,tokyo,enjoyed liveaction attack titan every time see posters im reminded freshly clean coiffed everyone apocalypse,0
303,445,apocalypse,,liked youtube video,0
304,446,armageddon,"california, united states",pbban temporary300 avysss armageddon kill flags fast xp reason,0
305,447,armageddon,"california, united states",pbban temporary300 russaky89 armageddon kill flags fast xp reason,0
306,448,armageddon,#flightcity uk  ,official vid doublecups gtgt,0
307,450,armageddon,,ouvindo peace love amp armageddon,0
308,451,armageddon,,best movie youve ever seen armageddon,0
