,id,keyword,location,text,target
1956,2817,cyclone,,xhnews need plants pacific cyclone seasons would help,1
1957,2819,cyclone,,bbc forced retract false claims cyclone pam,1
1958,2820,cyclone,,great condition easton cyclone softball bat fastpitch 9 2920 sk398,1
1959,2821,cyclone,philippines ,severe weather bulletin 5 typhoon ûïhannaphû soudelor tropical cyclone warning issued 500 pm 06,1
1960,2822,cyclone,"washington, dc",cyclone derives powers calm center person norman vincent peale,1
1961,2825,cyclone,hyderabad,roughdeal1 ante hudhud cyclone chandrababu valle ne ante ga,1
1962,2826,cyclone,vancouver (hq) and worldwide,cyclone komen devastates families myanmar week need help today,1
1963,2827,cyclone,"quezon city, philippines",severe weather bulletin 6 tropical cyclone warning typhoon hanna issued 1100 pm thursday 06 august,1
1964,2828,cyclone,geneva,back future vanuatu cyclone pam encouraged traditional ways living,1
1965,2829,cyclone,"hartford,  connecticut",bank manager asks tom interview cyclone tom loan given purchase bicycle,0
1966,2830,cyclone,"sioux falls, sd",excited cyclone football,0
1967,2831,cyclone,cornwall,bbc forced retract false claims cyclone pam,1
1968,2832,cyclone,beside basketball,talent misdirection cyclone pass ignite pass vanishing drive phantom shot kurokobot,1
1969,2833,cyclone,"rome, italy",comdev asia radio stations bangladesh broadcasting programs address upcoming cyclone komen,1
1970,2835,cyclone,tafekop ga-matsepe,like cyclone imperialism spins across globe militarism crushes peoples sucks blood like,1
1971,2836,cyclone,,1970 mercury cyclone gt hood moulding nice core cobra jet 429cj gt,0
1972,2838,cyclone,,im cyclone passion overblown,0
1973,2839,cyclone,,majesty emperor salman khans unstoppable cyclone entertainment humanity bajrangi bhaijaan creating history everywhere crosed 300 cr,0
1974,2841,cyclone,,1970 mercury cyclone gt quarter panel ds rear trim moulding cobra jet 429cj,1
1975,2842,cyclone,,tropical cyclone info soudelor 945hpa maximum wind speed 45ms maximum wind gust speed 60ms,1
1976,2843,cyclone,melbourne,cyclonereizei may ask cyclonesama read jailed fate rindou,0
1977,2844,cyclone,vilnius,drugs alcohol jackson vroman house,0
1978,2846,cyclone,geneva,blending old new vanuatu prepare future emergencies,0
1979,2849,cyclone,,wfp wfp delivers food 165000 bangladesh flood victims tropical cyclone komen dhaka ûòthe united na,1
1980,2851,cyclone,,rohingya houses kyee nockthie hamlet taungbazar region buthidaung severely damaged cyclone kasitaroch vivianunhcr,1
1981,2852,cyclone,made in america,cyclone double g would cherry top outfit ootd doubleghats,0
1982,2853,damage,"ps4, now stop asking",thelegendblue cozmo23 theyll probably allow us ascend get damage max values,0
1983,2854,damage,,drop nigga damage,0
1984,2855,damage,cheshire. london. #allover,unions say supportive london yet prepared damage economically å£300m last time,0
1985,2856,damage,"texas, usa",liked youtube video,0
1986,2857,damage,"bartholomew county, indiana",fyi accident property damage3460 limestone lncolyellowstone wayfieldstone dr08052015 193635,1
1987,2858,damage,u.s,fitness knee damage solution,0
1988,2860,damage,my mind is my world,complaining phoenix mode fire emblem turns ray gigant difficulty option take 0 damage,0
1989,2861,damage,,capicapricapri brentobento wha kids damage,0
1990,2863,damage,catskills,cleared accident property damage ny35 eb ny 100,1
1991,2864,damage,,crazy phone much damage person,0
1992,2865,damage,"columbia, sc",writebothfists got pretty windy damage,0
1993,2866,damage,,reusing advanced life equipments transit drumming champaign damage fdbdp,0
1994,2867,damage,right here,indigo6e carful spotting damage time check time giving away baggage loss wy,0
1995,2869,damage,texas,storm damage reported west tennessee,1
1996,2870,damage,"lawrence, ks via emporia, ks",hey royals love damage 2 outs,1
1997,2871,damage,http://twitch.tv/jcmonkey,drothvader cmnevalistis keep please arachys 2 pieces deals 4000 weapon damage 2500,1
1998,2872,damage,indonesia,mages fairy tail specialize property damage natsu dragneel,0
1999,2873,damage,unknown,bradleybrad47 yeah fast extremely high damage want fast im gonna get u,1
2000,2875,damage,unknown,bradleybrad47 saw fast af great damage upgraded shitton used exclusively whole playthrough,0
2001,2877,damage,"marysville, mi",lets say tree falls fence know homeowners insurance may help,0
2002,2878,damage,"new haven, connecticut",joedawg42 tor tor situation wind damage enhanced wording key imo,1
2003,2879,damage,,hfxstanfield beelievedc discoverycntr happening hear runway lighting damage contractor,1
2004,2880,damage,austin | san diego,swb1192 nda written damage ability offer services future prolly dont want work anyway,0
2005,2881,damage,??? ?? ??????? ,trillion crosses line 3rd time fieldwide attack instant kill damage,1
2006,2882,damage,"pontevedra, galicia",np metallica damage inc,0
2007,2883,damage,somewhere in the canada,nine inmates charged causing damage calgary remand centre riot,1
2008,2884,damage,london/new york,pt crosssectarian protest powerful shia cleric says militias must withdrawur fightin isis wont forget damage uve done ur ppl,1
2009,2885,damage,"261 5th avenue new york, ny ",homeowners insurance cover water damage good things know,1
2010,2886,damage,,beach damage shit,1
2011,2887,damage,,wonderousallure crosses arms cover hands anymore damage hhello,0
2012,2888,damage,,new post blog,0
2013,2889,damage,charlotte nc,reported hit amp runin roadwayproperty damage 15901 statesville rd,1
2014,2890,damage,,devil may cry 4 special edition vergil vs agnus window mission 6 dmd damage leedstraif,0
2015,2891,damage,"rockville, maryland",glaucoma occurs fluid builds pressure inside eye level may damage optic nerve eyefacts,1
2016,2893,damage,,jsunnews storm damage reported madison county thunderstorm damage reports ar,1
2017,2895,damage,,s61231a puncture wound without foreign body left index finger without damage nail initial encounter icd10,1
2018,2896,damage,australia,thank richarkkirkarch ausinstarchitect words warning queenswharf brisbane,0
2019,2898,damage,your conversation,real shit damage bitch,0
2020,2899,damage,usaov,lmao fuckboy changed damage control pseudojuuzo,0
2021,2900,damage,"bhopal, madhya pradesh, india.",michaelwestbiz standard damage control,1
2022,2902,damage,tennessee,gettinglost jennellensbb munclejim said superficial wounds pepper spray damage,1
2023,2905,danger,,blizzheroes dustinbrowder dad wont chase constantly amp time frequently great deal danger distraction lt3,0
2024,2907,danger,#lemongang ,believe shirt company every animal ever danger better start seeing changes wildlife,0
2025,2908,danger,ayr,danger union bears,0
2026,2909,danger,,signup open falling danger release day blast review tour signup,1
2027,2910,danger,worldwide,dyannbridges yeshayad check rockin preview claytonbryant danger zone coming soon,0
2028,2911,danger,"san jose, california",red flag warning fire danger amp dry thunderstorms bay area,1
2029,2912,danger,worldwide,carsonrex spaceangelseven check rockin preview claytonbryant danger zone coming soon,0
2030,2913,danger,"loughborough, england",like could danger something,1
2031,2915,danger,killarney,last tree cut last fish eaten last stream poisoned realize,0
2032,2916,danger,"brooklyn, ny",take away preservation parks r imposition amp danger african people never imagined,0
2033,2917,danger,lahar & gwalior,indian govt amp media take serious concern safety danger,1
2034,2920,danger,"st paul, mn",training grains wheat bare gold august heat anger im trespass lest seek danger,0
2035,2921,danger,atlanta georgia ,therealrittz fettilootch slanglucci oppressions greatest danger coming soon album,0
2036,2922,danger,,morehouse64 appears govt lost ethical moral relevance means whole usa population danger,0
2037,2924,danger,"lincoln, il",dont like head first slides especially home danger,0
2038,2925,danger,world,permits bear hunting danger outnumbering actual bears licenses floridas fir,0
2039,2927,danger,spinning through time.,riverroaming much danger please,0
2040,2929,danger,atlanta georgia ,bluebirddenver fettilootch slanglucci oppressions greatest danger coming soon album,1
2041,2931,danger,"boston, ma",uber looking repair recent bad rap nonprofit partnerships,0
2042,2932,danger,hailing from dayton ,wish could get victorias secret front im good,0
2043,2933,danger,worldwide,turnedonfetaboo hsjb215 check rockin preview claytonbryant danger zone coming soon,0
2044,2934,danger,"newcastle upon tyne, england",thetxi gunnersfan89 would arsenal fans want west ham relegation battle season danger afc sun,0
2045,2935,danger,atlanta georgia ,remainontop fettilootch slanglucci oppressions greatest danger coming soon album,0
2046,2936,danger,atlanta georgia ,nuggets fettilootch slanglucci oppressions greatest danger coming soon album,0
2047,2937,danger,,danger excitement underwater cave diving,0
2048,2939,danger,,girl wanna save like danger health try somebody wanna somebody else,0
2049,2941,danger,instagram: trillrebel_,guns protection shit really shouldnt used unless life danger,0
2050,2942,danger,always dying never resting,thirsty yall danger dehydration,1
2051,2943,danger,"san jose, ca",thunderstorms little rain expected central california high fire danger weather cawx,1
2052,2944,danger,2005 |-/,wanna get danger days tattoo bad cool would spider look like someones wrist smth,0
2053,2945,danger,israel,experience youre always angry critical pundit grave danger going rails 1,0
2054,2946,danger,uruguay / westeros / gallifrey,danger skyler danger,0
2055,2947,danger,"kansas city, mo",dangerous ok rest us danger,0
2056,2948,danger,"silver spring, md",investigate robert mueller didnt respond complaints since nov 2011 amp left meson danger,0
2057,2950,danger,jersey - c.i,honestly tho modibo maiga stealing living fuck im past best still danger fucktard coyi,1
2058,2952,danger,,fear way making us see danger none contemplating logic behind situation find courage engage,0
2059,2953,dead,,joel 228 book acts 217,0
2060,2954,dead,afghanistan,17 dead afghanistan aircraft crashes afghan military helicopter crashed remote region,1
2061,2955,dead,sweden,silent0siris even awesome norse landscapes loads atmosphere life boringdead snotgreen wastelands,0
2062,2956,dead,,miss longer hairbut dead anyways wasnt even hair,0
2063,2957,dead,,cjbanning 4sake argsuppose preborn attained individl rightsgenerally courtof law forbids killing unless dead person something,0
2064,2959,dead,london,remember time goku gave life dead birb hell goku,0
2065,2960,dead,"orlando, fl",naaa bee dead like legit zombie feel every sore part body,0
2066,2963,dead,,happened get road right behind buses im dead serious,0
2067,2965,dead,atmosphere,lmfao fucking luis hhahaha im dead,0
2068,2969,dead,,watched emmerdale nd dont know slightly attractive man named ross got beat nd hes dead,1
2069,2970,dead,glasgow,soapscoop need confirm ross dead cause dont trust anyone else yh,0
2070,2971,dead,,gailsimone iwasdisappointedby telltales walking dead good characters ampstory real gameplay many performance issues,0
2071,2973,dead,,beforeitsnews hundreds feared dead libyan migrant boat capsizes rescue û,1
2072,2974,dead,somewhere in portugal,itûªs war came see never see waved white flag front canûªt end dead wont misled,0
2073,2975,dead,south stand,jones94kyle oh fuck sake dead,0
2074,2976,dead,dundalk ireland,emmerdale ross really dead askcharley,0
2075,2980,dead,,avoid wearing dead black flaming red stark white much esp debate go blue gold brown even shoes,0
2076,2982,dead,,perspectives grateful dead critical writings contributions study,1
2077,2983,dead,"sochi, kda, ru",hlportal hello im looking mod cold ice saw site link download dead maybe share thanks,0
2078,2984,dead,"ìït: -26.695807,27.837865",kg4vaal lmaovv hard ny new trend babalmaowelcome nyozi kwaaaaadead,0
2079,2987,dead,south stand,jones94kyle ive said hes dead one else dies,0
2080,2988,dead,you're not 19 forever   ,ross dead noooooooooooo mikeparractor,0
2081,2990,dead,"kettering, oh",thinking time friend bailed nite b4 dead showwent alone amp great time alone free dance front row,0
2082,2991,dead,united states,typhoon soudelor taking dead aim taiwan,1
2083,2992,dead,,askcharley emmerdale emotional ross dead emmerdale 5,0
2084,2993,dead,planet earth,man found dead demi moores swimming pool,1
2085,2995,dead,spare 'oom,thats val dead im suing,1
2086,2998,dead,,atchisonsean dead,0
2087,3000,dead,united states,wyrmwood road dead 2014 fucking awesome awesome ending awesome one,0
2088,3001,dead,milton keynes ,cant believe ross dead emmerdale mikeparractor emmerdale summerfate,0
2089,3003,death,,call text 2 niggas bff amp boyfriend love boys death niggas hold attention like,0
2090,3004,death,atl??al??,hate talking otp grandma mean love death talk damn much ssshhheeesshh,0
2091,3005,death,uptown ,death ill forever rep jets,1
2092,3006,death,,vibrator shaped vape done busted,0
2093,3009,death,prov,death threats nigga life well gon see,0
2094,3010,death,"novi, mi",adult dies plague colorado,1
2095,3011,death,new york,xbox 360 pro console red ring death full read ebay,0
2096,3012,death,"buenos aires, argentina",going back gainesville death,1
2097,3013,death,on the go,year later ferguson sees change asks itûªs real,0
2098,3014,death,,papiichampoo enjoy obama era civility prez says gop supports iranian death,0
2099,3015,death,,feel like death,0
2100,3016,death,the uk,liked youtube video jeromekem,0
2101,3018,death,,tell cousins dont wanna hang text saying coming honestly death wish,0
2102,3019,death,,rss judge orders texas recognize spouse samesex death certificate,0
2103,3021,death,mpls. ,loyalty mission involves kicking shitty nobleman death love elven weirdo,0
2104,3022,death,"kensington, md",,1
2105,3023,death,buffalo/dc,kellkane thanks narrowly averted death fun youre right,1
2106,3025,death,,,0
2107,3026,death,"sylacauga, alabama",allahsfinest12 death muslims,1
2108,3027,death,,going starve death,0
2109,3029,death,,ted cruz bashes obama comparison gop iranians shouting death america,0
2110,3030,death,,,0
2111,3034,death,,new crime knowing rights punishable death,0
2112,3036,death,usa,issues uploading death smoochy awakenings clips youtube reason bicentennial man pain ass,0
2113,3037,death,to the right of you!,ted cruz bashes obama comparison gop iranians shouting death america,1
2114,3038,death,cyprus,cyprus news analysis mullah omars death may split talibans ranks omars demise would certainly lead,1
2115,3039,death,kansas,feel like deathholy molys,0
2116,3042,death,"los angeles,ca, usa",video slain mexican journalist unknowingly predicted death,0
2117,3043,death,"portland, or",old lady rockin death metal sedan downtown smoking cigarette found real mom,0
2118,3044,death,carry on jutta!!!,afghan peace talks doubt mullah omars death financial times mullah,0
2119,3045,death,home of the takers.,yall pusssssssssy shoook death,0
2120,3047,death,"new york, new york",first trial death cecilthelion postponed,0
2121,3048,death,,53 years ago week anniversary marilyn monroes death ripriprip,0
2122,3049,death,?s????ss? a?????,aris hints snippets death,0
2123,3051,death,chicago,tomorrow death,0
2124,3052,death,"alicante, spain",new nyc legionnaires disease death toll rises,1
2125,3053,deaths,,vaxshill 2 deaths measles complications 10 yrs everyone looses shit 8 dead legionnaires month amp crickets,1
2126,3054,deaths,,bigamist û÷firstûª wife charged deaths û÷secondûª pregnant wife child 8 mother nephew 1 uû,0
2127,3055,deaths,"mooresville, nc",dont get i77 south huge wreck airlift maybe deaths interstate completely blocked,1
2128,3056,deaths,"mooseknuckle, maine",ûïlolgop 22 cases voter fraud year need new laws 83 gun deaths day actually follows laws amirite vra50û,1
2129,3057,deaths,"palermo, sicily",silence palermo shipwreck children deaths,1
2130,3058,deaths,,bsf jawans died fidayeen aks bloody insas insas rifles blame soldiers deaths mod,1
2131,3059,deaths,asunciì_n-py / tì_bingen-ger,breast milk original superfood rates worldwide stalled 40 contributing 800000 child deaths last year,0
2132,3060,deaths,"voorhees, nj",12 deaths redlight running crashes pedestrians bicyclists amp vehicle occupants hit redlight runners,1
2133,3061,deaths,,rt truediagnosis 250k deaths per year physician error,1
2134,3062,deaths,,cdcwhistleblower 2 deaths measles complications 10 yrs everyone looses shit 8 dead legionnaires month amp crickets,1
2135,3064,deaths,,bigamist first wife charged deaths second pregnant wife child 8,0
2136,3066,deaths,uk,500 deaths year foodborne illness frackfreelancs dears deccgovuk frackfreeeu tarletonsophie,1
2137,3068,deaths,"atlanta, ga",hear drfriedencdc talk avoid thousands resistant infectionsdeaths next 5 yrs,0
2138,3070,deaths,planet earth,irony died thousand deaths,0
2139,3071,deaths,wakanda,strickskin nickscomics lol usually im objective maybe uncle ben course deaths end business usual,0
2140,3072,deaths,lagos,comment deaths older children data tell us,1
2141,3073,deaths,does it really matter!,deaths 7,1
2142,3074,deaths,,eazzyp never know would happened govt seemed think beliefs warranted deaths innocent japs,1
2143,3075,deaths,your screen,real magic real life women went missing ohio town focus fbi probe strange deaths,1
2144,3077,deaths,"phoenix, az",two cases dont constitute epidemic,1
2145,3079,deaths,does it really matter!,deaths 3,0
2146,3080,deaths,edinburgh,lunch stewart amp julian couple hours earlier good finally find happened,0
2147,3082,deaths,weyburn,weyburn police warn public fentanyl deaths province,1
2148,3083,deaths,uga '15 alumnus - economics ,none annoying crusty lives matter head ass people ever actually support causes hate black deaths get attention,0
2149,3084,deaths,,time reduce gun deaths,1
2150,3085,deaths,,gregorysanders usdot amp stat high auto deaths applies children vehicle guess run lightrail better adult,0
2151,3086,deaths,blackpool,cancers equate around 25 deaths blackpool kowing signs could save life,1
2152,3089,deaths,"the void, u.s.a",highqualitybird reverse situation lol dont know 911 us civilian deaths specifically utilized make political,1
2153,3090,deaths,london town..,heard theres two deaths murder chrissie kills adam val finn die emmerdale,0
2154,3091,deaths,tennessee/gallifrey,mathewisangry z3kesk1 saladinahmed died horrible deaths trapped ships knew risk,1
2155,3092,deaths,"amman, jordan",fco minister tobiasellwood condemns attack mosque saudi arabia resulted least 15 deaths,1
2156,3093,deaths,blackpool,cancers equate around 25 deaths blackpool kowing signs could save life,1
2157,3095,deaths,"washington, d.c.",critters climate two plague deaths colorado,1
2158,3097,deaths,,since 1940 year angela sanders born roundhouse kick related deaths increased 13000 percent,1
2159,3099,deaths,"columbia heights, mn",walmart taking steps keep children safe hot vehicles take look innovative car seat,0
2160,3100,deaths,top secret,2010 17 beluga deaths reported seaworld average age 15 12 years opseaworld,1
2161,3101,deaths,"ìït: 10.614817868480726,12.195582811791382",bigamist first wife charged deaths second pregnant wife child 8 mothe,1
2162,3102,deaths,top secret bunker ,mayoroflondon pls reduce cyclist deaths compulsory highway code test every vehicle uses road notrocketscience,1
2163,3104,debris,"belbroughton, england",aerospace exec plane debris missing mh370 part aircraft wing found reunion island th,1
2164,3105,debris,,malaysia airlines flight 370 disappeared 17months ago debris found south indian ocean,1
2165,3106,debris,,mh370 aircraft debris found la reunion missing malaysia airlines,1
2166,3107,debris,772 temperance permenence,discovered plane debris missing malaysia airlines flight 370 time,1
2167,3108,debris,,confirmed debris mh370,1
2168,3109,debris,,mh370 aircraft debris found la reunion missing malaysia airlines,1
2169,3111,debris,nigeria ,malaysia confirms plane debris washed reunion island flight mh370,1
2170,3112,debris,,mh370 aircraft debris found la reunion missing malaysia airlines,1
2171,3114,debris,"46.950109,7.439469",missing jetûªs debris could floated rì©union new york times,1
2172,3115,debris,,rì©union debris almost surely flight 370 officials say new york times,1
2173,3116,debris,,rì©union debris almost surely flight 370 officials say new york times,1
2174,3117,debris,in the shadows,debris found reunion island flight mh370 mystery behind plane disappearance could better novel,1
2175,3118,debris,,mh370 aircraft debris found la reunion missing malaysia airlines,1
2176,3119,debris,campo grande-ms,reuters debris confirmed mh370 relatives hope discovery crash site,1
2177,3120,debris,nbc washington,nbcnightlynews malaysian officials say debris found reunion island mh370 billneelynbc reports,1
2178,3122,debris,,mh370 debris found reunion island sad tragedy innocent crash mh370,1
2179,3123,debris,seattle,love food fun malaysian prime minister najib razak confirmed aircraft debris found rì©union isla,1
2180,3124,debris,"hamilton, ontario canada",malaysia seem certain france plane debris missing mh370,1
2181,3125,debris,new york,malaysian officials say debris found reunion island mh370 billneelynbc reports,1
2182,3126,debris,,mh370 aircraft debris found la reunion missing malaysia airlines,1
2183,3130,debris,,debris found reunion island comes mh370 malaysian pm,1
2184,3131,debris,,aircraft debris found island mh370 malaysia confirms,1
2185,3132,debris,"dubai, united arab emirates",irony debris flight mh370 found reunion island,1
2186,3133,debris,india,mh370 aircraft debris found la reunion missing malaysia airlines abc online,1
2187,3134,debris,hong kong,mh370 reunion debris missing malaysia flight,1
2188,3136,debris,"berlin, germany",experts leave lab malaysia confirms debris mh370,1
2189,3137,debris,nigeria ,malaysia confirms plane debris washed reunion island flight mh370,1
2190,3138,debris,iraq,kamindoz reuters debris confirmed mh370 relatives hope discovery crash,1
2191,3139,debris,,plane debris discovered reunion island belongs flight mh370 ûò malaysian pm,1
2192,3140,debris,"tampa, fl",debris confirmed mh370 relatives hope discovery crash site malaysian officials confirm breakth,1
2193,3141,debris,world news,abc onlinemh370 aircraft debris found la reunion missing malaysia airlines abc onlinea piece aircraft debris,1
2194,3142,debris,hong kong,malaysia confirms reunion island debris mh370,1
2195,3144,debris,,debris confirmed mh370 relatives hope discovery crash site,1
2196,3145,debris,hong kong,plane debris missing mh370,1
2197,3147,debris,,mh370 aircraft debris found la reunion missing malaysia airlines abc onlin,1
2198,3150,debris,"bristol, uk",interesting mh370 aircraft debris found la reunion missing malaysia airlines abc,1
2199,3152,debris,"labuan, malaysia",aircraft debris confirmed mh370 nation star online,1
2200,3153,deluge,united kingdom,dustpiggies ah awash abstract dustpig tweets explains deluge,0
2201,3154,deluge,right next to you,xeni bet mother nature might plans send deluge way,0
2202,3155,deluge,ct ? nyc,joshsternberg feed seems deluge twice week itûªs fantastic,0
2203,3157,deluge,www.tmgcgart.com,romeocrow welcome organizing twitter find important stuff amongst deluge btw loving music signed ep,0
2204,3158,deluge,,niagara falls package deals deluge tours yyeso,0
2205,3159,deluge,"london, england",apologise sincerely inevitable deluge gbbo tweets come wont hold grudges decide unfollow baking cakes,0
2206,3161,deluge,"los angeles, ca",rt nlmdimrc deluge resources floods medical providers cleanup workers amp,1
2207,3162,deluge,,towboat trek sympathy deluge falls vtc,1
2208,3163,deluge,,deluge eulogies cecilthelion whatsapp gtgtthis tormented soul matias xavier,0
2209,3165,deluge,australia,wa smiles july deluge west australian,0
2210,3166,deluge,brisbane,china delaying deluge fundamentals economy support valuations stock,0
2211,3167,deluge,melbourne-ish,despite deluge fantasticfour notices man ocuana still buying tickets hes bloodyminded like,0
2212,3168,deluge,617-btown-beatdown,photo forrestmankins colorado camping,0
2213,3170,deluge,"brackley beach, pe, canada",deluge troisrivieres one hour get legionstrackandfield,0
2214,3171,deluge,london,many halfnaked men twitter tonight normally id embrace odd torso scale tonights deluge unprecedented,0
2215,3172,deluge,518,theburnageblue yes man bad week far events deluge favs turned right around,0
2216,3173,deluge,"nottingham, england",best windows torrent client recommended deluge looks like written 10 years ago java swing uses worse,0
2217,3174,deluge,earth 3,fifth predynastic king legendary period deluge,0
2218,3175,deluge,,theghostparty amsosorry deluge hell vines,0
2219,3176,deluge,,strange encaustic cerography portion till give voice deluge byityf,0
2220,3177,deluge,"enniscrone & aughris, sligo ",back beach deluge surf camp motion surf therapy programme kicked today,1
2221,3179,deluge,"mostly wellington, nz ",stephaniemarija light rain forecast based dressing light rain incessant deluge,0
2222,3180,deluge,london,perhaps historic applied deluge recently exposed childsexabuse truly historic scale coverup,1
2223,3181,deluge,,bible sometimes backs truck unloads descriptive deluge indecency us chuckswindoll explains iflcanada next,0
2224,3182,deluge,usa,audio 16 business owners share would differently pt1,0
2225,3183,deluge,,whole slew updated posts coming hosting fixed unfml deluge,0
2226,3184,deluge,617-btown-beatdown,photo boyhaus heaven sent jakeåê ûïafter warm morning montanaûªs madison river early evening,0
2227,3185,deluge,,famping things gishwhes got soaked deluge going pads tampons thx mishacollins,0
2228,3186,deluge,,fiendnikki deluge awesome word idea like much,0
2229,3188,deluge,,wrinkled face deluge decayed,0
