,id,keyword,location,text,target
3810,5412,first responders,"nashville, tennessee",im grateful first responders mnpdnashville nashvillefd others acted swiftly save countless lives today,1
3811,5413,first responders,texas,usatoday praying gods healing safety first responders,0
3812,5416,first responders,long eaton åá derbyshire åá uk,join charity 10k run event doningtondash 11am start sun 20 sept 2015 castle donington community first responders,0
3813,5417,first responders,worldwide,loved way book written include many vantage points first responders detkenlang kindle,0
3814,5418,first responders,,first responders would never sent wrong address w smartteks gpsbased panic button mpers safety,0
3815,5420,first responders,"portage, in / worldwide",û÷we helpûª says denver firefighter working curb first responder suicide,1
3816,5423,first responders,"victoria, bc  canada",whats cool teens becoming like call digital first responders friends need little help support,0
3817,5425,first responders,,carmike cinemas antioch shooting grateful staff first responders safety highest priority,1
3818,5426,first responders,roads/trails everywhere,rt roadid thanks alex story amp first responders need û,0
3819,5428,first responders,new york city,added sandy first responders lost homes vip home page group vimeo,1
3820,5430,first responders,"nashville, tn",thankful first responders especially mnpdnashville life saving response today antioch,1
3821,5432,first responders,,juneau empire first responders turn national night,0
3822,5437,first responders,"liberty township, ohio",reds dont throw word hero around lightly usually reserved first responders military hes hero,0
3823,5439,first responders,aberdeenshire,us wants future first responders hightech,0
3824,5442,first responders,"los angeles, ca",theres still room party first responders around country 3rd annual best ever,0
3825,5443,first responders,a hoop somewhere,incase accident first responders would know baby present,0
3826,5444,first responders,michigan,kirsten gillibrand,1
3827,5445,first responders,"bloomington, indiana",help says denver firefighter working curb first responder suicide,1
3828,5446,first responders,usa,first responders convene national summit awards gis technology,0
3829,5448,first responders,,york co first responders compete save lives û÷badges bloodûª paramedic ems,0
3830,5449,first responders,"washington, dc",good info help first responders cope individual resilience factsheet responders,0
3831,5450,first responders,,iafflocal4416 lives lost except first responders public theyre charged protecting,1
3832,5452,first responders,"basking ridge, nj",first responders get int bridgeportspeed free saturday details,0
3833,5454,first responders,"stalybridge, tameside",999day emergency services display meeting brave police firefighters first responders help keep us safe,1
3834,5455,first responders,,week first responders dart members participating four day intensive technical large animal,1
3835,5458,first responders,"sacramento, ca",firefighters make gains rockyfire jerry brown heading area meet first responders tomorrow morning,1
3836,5459,first responders,"franklin, tn near nashville",shooting event theater starbucks giving free coffee first responders police amp firefighters antiochhickoryhollowtn,1
3837,5460,first responders,"st. louis, missouri",lender fees veterans first responders past present linkedin,0
3838,5461,flames,bandung,new giant flames giant full black pantofel infoorder sms087809233445 pin23928835,1
3839,5462,flames,new york,new snap tools black baseball hatcap silvergray embroidered logo flames full reû,0
3840,5465,flames,new york,new snap tools black baseball hatcap silvergray embroidered logo flames full reû,0
3841,5466,flames,"louisville, ky ",vampiro going table flames ultimalucha luchaunderground elreynetwork,0
3842,5467,flames,,cabin fever 2 flames,0
3843,5468,flames,"manhattan, ny",cant summon flames directly hell store bought fineme momdies,0
3844,5469,flames,freeport ny,added fire flames saturday rick wonder spinning guest set along chachi,0
3845,5471,flames,650/559,kelworldpeace taxstone yoga flames,0
3846,5473,flames,,sbnation flames makes good penalty killer,0
3847,5475,flames,dreamy lake,guess say igs hopes went flames,0
3848,5476,flames,,ill cry pity partys flames,0
3849,5477,flames,houstn,new lil b x chance nothing flames,0
3850,5479,flames,hell,gilderoy wish good enough add flames nails im fire,1
3851,5480,flames,"asheville, nc",gang walking round brown flames amp thats 100nd,0
3852,5481,flames,new york,new snap tools black baseball hatcap silvergray embroidered logo flames full reû,0
3853,5482,flames,st. patrick's purgatory,tadhgtgmtel dude smoking fucking thing went flames though bomb went omg scared,1
3854,5484,flames,,maryland mansion fire killed 6 caused damaged plug christmas tree report says flames,1
3855,5485,flames,@cockerelshoes,new giant flames giant manly brown infoorder sms087809233445 pin2327564d,0
3856,5486,flames,united states,ûïyou see devastation amp itûªs shockingûï firefighters continue battle flames california benstracy reports û,1
3857,5487,flames,manaus,watching go flames,1
3858,5488,flames,"sioux falls, s.d. ",rp said see smoke coming silo 260th street hartford flames,1
3859,5489,flames,,chose search joy two us weûªll near smiles matter cold flames burn bod portgassdk,0
3860,5491,flames,republica dominicana,maryland mansion fire killed 6 caused damaged plug christmas tree report says flames firefighters bravery,1
3861,5492,flames,"eastlake, oh",erinmariefishy everyone setting flames upon,0
3862,5493,flames,"hillsville/lynchburg, va",flamesnation thats optimistic side doubt tough done feel like games pivot defense,0
3863,5494,flames,u.s.a,maryland mansion fire killed 6 caused damaged plug christmas tree report says flames,1
3864,5495,flames,some where,pardon burst flames ive enough world peoples mindless games,0
3865,5496,flames,travelling around the world ,awickedassassin want burst flames anna hugged tightly,0
3866,5497,flames," 616 û¢ kentwood , mi ",selmoooooo edvinnn imtariik dzaficharis selmo u catching flames im gonna witnessing slaughter,1
3867,5498,flames,,bloody ell let burn rubybot,0
3868,5499,flames,,opinion dont put thh internet furst flames,0
3869,5501,flames,? jet life ?,rising follower graph 2 followers past week get stats right,0
3870,5502,flames,fairy tail! ,aisumage akumareisu gray ophelia red flames blazing around person setting nearly everything area,1
3871,5503,flames,santo domingo alma rosa ,soloquiero maryland mansion fire killed 6 caused damaged plug christmas tree report says flames firefighte,1
3872,5505,flames,somewhere around you,maryland mansion fire killed 6 caused damaged plug christmas tree report says flames,1
3873,5506,flames,houston |??| corsicana,cwhoops better make shots tomorrow cause im recording flames thrown tomorrow,0
3874,5507,flames,"cincinnati, oh",added video youtube playlist,0
3875,5509,flames,bacon,better sean bro admit sean flames better sean,0
3876,5510,flames,,advantages apropos flames favorable regard mississauga ontario pwhvgwax,0
3877,5514,flattened,some other mansion,flattened cartoonylike whoa papa,0
3878,5515,flattened,chicago,road success paved pennies flattened train tracks youre welcome,0
3879,5517,flattened,"astley, manchester",feel like ive flattened sumo wrestler pain gain muaytai wantmyabsback strong,0
3880,5518,flattened,"bow, nh",ideas food flattened,0
3881,5519,flattened,leicester,zouma flattened cfc,0
3882,5520,flattened,"frome, somerset, england",zouma absolutely flattened guy,0
3883,5521,flattened,mars,flattened,0
3884,5522,flattened,"melbourne, victoria",70 years ago first atomic attack flattened hiroshima 3 days later nagasaki war crimes put moscow place,1
3885,5524,flattened,uk,today august 6th 70th anniversary abomb little boy dropped hiroshima70000 killed outright city flattened,1
3886,5525,flattened,"essex, england",would flattened little midget,0
3887,5526,flattened,"new york, ny",said yosemite sam drumpf ûïnobody û÷ill vote flattened rabbit skin ahuh huh û always sayû,0
3888,5528,flattened,somewhere too cold for me,grabakahitman izigarcia flattened machidadid lose fightnope lost fights guys shouldnt lost also,1
3889,5529,flattened,barbados,floored4 flattened early birds get de cups lag bout pun de dock watch ppl drinkû,0
3890,5531,flattened,,conklin flattened shuffled feet instead kick slide didnt get hands chest,0
3891,5532,flattened,leeds,flattened thee striker,1
3892,5534,flattened,"wahpeton, nd",picking flattened hay men masonite wahpeton nd,0
3893,5535,flattened,,zouma flattened guy,0
3894,5538,flattened,"chorley, lancashire, uk",fylde building set flattened one prestonûªs city centre iconic buildings disappearing skyline,0
3895,5539,flattened,,iamhorsefly hide kids hide wife hes loose thought flattened ball,0
3896,5540,flattened,,wouldve great mbiwa flattened little rat,0
3897,5541,flattened,"northampton, ma",jimmozel puckflattened ball lol,0
3898,5544,flattened,ventura,dont doubt implicit statement makes want flattened bus,0
3899,5545,flattened,le memenet,kainyusanagi grummz pixelcanuck flattened raynor raynor balding imperfect biker marine emo generic western hero,0
3900,5547,flattened,"lubbock, texas",seanpeconi jasonfloyd lynchonsports criscyborg think risk losing getting nose flattened lot,0
3901,5548,flattened,derby,mums literally picked new car today flattened battery already trying sort bluetooth muppet,0
3902,5552,flattened,"mississauga, ontario",tweetinglew tersestuff notley flattened harper heartland harper imported tens thousands tfw slaves cost albertans jobs,0
3903,5553,flattened,delhi ,twilightfairy flattened frog,0
3904,5554,flattened,"keighley, england",imagine getting flattened kurt zouma,0
3905,5555,flattened,pomfret/providence,fallacy steam roller object whether flattened robertcalifornia thereisonlysex,0
3906,5556,flattened,"baltimore, md",photo beach earrings beach jewelry vacation earrings keep calm beach earrings made flattened,0
3907,5557,flattened,,100 1 mix new flat double sided linerless bottle caps choose mix flattened full reû,0
3908,5558,flattened,"east lansing, mi",bigburgerboi55 flat footballs like flattened spartans crushing back day hail,0
3909,5559,flattened,rocketing through the galaxy,satanaofhell ever seen far dreamy look came face ears flattened started walk slowly toward youd,1
3910,5560,flattened,new york,100 1 mix new flat double sided linerless bottle caps choose mix flattened full reû,0
3911,5561,flood,boston,fizzy sitting regular flood seats one knows,0
3912,5563,flood,united states,jkl cancels flash flood warning bell harlan knox ky,1
3913,5564,flood,new york,spot flood combo 53inch 300w curved cree led work light bar 4x4 offroad fog lamp full reû,1
3914,5565,flood,new york,spot flood combo 53inch 300w curved cree led work light bar 4x4 offroad fog lamp full reû,0
3915,5567,flood,"warrandyte, australia",small flood bigåêconsequences,1
3916,5569,flood,"british columbia, canada",homecoming queen killed way home prom flood waters socialnews,1
3917,5570,flood,,2pcs 18w cree led work light offroad lamp car truck boat mining 4wd flood beam full reaû,0
3918,5573,flood,,raining since left im drowning flood see ive always fighter without give,0
3919,5575,flood,aix-en-provence/utrecht,creationmin rwrabbit gooneratheist atheistic1 lolatjesus yet still many fish die worldwide flood wonder,0
3920,5576,flood,philadelphia,please dont flood poor robertbenglunds mentions hes put work,1
3921,5577,flood,new york,spot flood combo 53inch 300w curved cree led work light bar 4x4 offroad fog lamp full reû,0
3922,5578,flood,"van buren, mo",atlarnxx didnt,0
3923,5579,flood,new york,12 72w cree led work light bar alloy spot flood combo diving offroad 4wd boat full readû,0
3924,5580,flood,new york,2pcs 18w cree led work light offroad lamp car truck boat mining 4wd flood beam full reaû,1
3925,5581,flood,"niagara falls, ontario",hellotybeeren cue flood people ironically calling,0
3926,5582,flood,usa,motors hot deals 452 gtgt,0
3927,5584,flood,,85v265v 10w led warm white light motion sensor outdoor flood light pir lamp auc,0
3928,5586,flood,hawaii usa,iembothfo 1000 2 nnw hana maui co hi county official reports coastal flood û,1
3929,5587,flood,new york,1 pair new 27w 4 round led work driving flood light offroad atv utv full read ebay,0
3930,5588,flood,new york,2pcs 18w cree led work light offroad lamp car truck boat mining 4wd flood beam full reaû,0
3931,5589,flood,,internet basics flood defective intertissue soul mate milk trench host guabxfv,1
3932,5590,flood,,bmx issues areal flood advisory shelby al till aug 5 900 pm cdt,1
3933,5592,flood,new york,2pcs 18w cree led work light offroad lamp car truck boat mining 4wd flood beam full reaû,0
3934,5593,flood,usa,flood advisory effect shelby county al 9 pm alwx,1
3935,5594,flood,united states,rt grantfactory grants funds weymouth meeting seawalls flood grants set thursday night û,1
3936,5595,flood,new york,spot flood combo 53inch 300w curved cree led work light bar 4x4 offroad fog lamp full reû,0
3937,5598,flood,new york,spot flood combo 53inch 300w curved cree led work light bar 4x4 offroad fog lamp full reû,0
3938,5599,flood,new york,spot flood combo 53inch 300w curved cree led work light bar 4x4 offroad fog lamp full reû,0
3939,5600,flood,united states,flood advisory issued august 05 428pm edt nws,1
3940,5602,flood,,survived plague floated flood peeked heads mud ones immune deafening bells god survive,0
3941,5603,flood,new york,spot flood combo 53inch 300w curved cree led work light bar 4x4 offroad fog lamp full reû,0
3942,5604,flood,usa,flood prone waterways westchester county eligible millions state aid newyork,1
3943,5605,flood,waddesdon,chinese rescue team arrives myanmar help flood victims,1
3944,5608,flood,"knoxville, tn",flood advisory issued august 05 710pm cdt august 05 800pm cdt nws urban,1
3945,5609,flood,new york,12 72w cree led work light bar alloy spot flood combo diving offroad 4wd boat full readû,0
3946,5611,flooding,"rock springs, wy",rock springs ûò residents living elk street continue battle flooding issues mondayûªs rain storm whileû,1
3947,5612,flooding,vietnam,cuban leader extends sympathy vietnam flooding,1
3948,5613,flooding,"tampa-st. petersburg, fl",business sponge docks washed rain flooding,1
3949,5614,flooding,,warlordqueen thrusts little jams cock deep inside flooding womb pussy hot thick cum,0
3950,5617,flooding,usa,severe thunderstorms flash flooding possible midsouth midwest,1
3951,5618,flooding,"huntsville, alabama",1130a radar update widespread showersstorms moving areasminor flooding possible hunwx,1
3952,5619,flooding,"nova scotia, canada",tips prevent basement leaks create control joints eliminate random cracking homeimprovement flooding,0
3953,5620,flooding,,flooding,1
3954,5621,flooding,metro manila,adorableappple reported flooding po area ten4 mmda,0
3955,5622,flooding,,flooding kills 166 displace one million pakistan daily news amp analysis,1
3956,5624,flooding,breaking news,flooding kills 166 displace one million pakistan daily news amp analysis,1
3957,5625,flooding,jakarta/kuala lumpur/s'pore,laos flooding 10 villages underwater world vision responding,1
3958,5626,flooding,uk,floods ukfloods british trekkers rescued amid flash floods himalayas group british tr,1
3959,5627,flooding,,slopeofhope maybe plan dilute safely say start charging longs would come flooding,0
3960,5628,flooding,vietnam,cuban leader extends sympathy vietnam flooding,1
3961,5629,flooding,,ill dm hotel info people flooding notifications asking info,0
3962,5631,flooding,i accept song requests,waves flooding shore cant find way home anymore thats look,1
3963,5632,flooding,"honolulu, hawaii",flooding occurs home stop mold growth via proudgreenhome,1
3964,5633,flooding,,,1
3965,5634,flooding,"miami beach, fl",chinese flooding nyc market like never,0
3966,5635,flooding,republic of texas,obama keeps 27 iraqi christian asylum seekers ndetention flooding us wunscreened muslims,1
3967,5638,flooding,"california, usa",grateful support flooding netkicorp dinner guests thank,1
3968,5641,flooding,huntsville al,flash flooding madison valleywx,1
3969,5642,flooding,? ,themaine soon start flooding comment section come brazil comments bc,0
3970,5644,flooding,don't run,last year lot drums flooding janice im falling,0
3971,5645,flooding,west midlands,ûïbbcengland burst water main causes major flooding birmingham hospital,1
3972,5646,flooding,jakarta/kuala lumpur/s'pore,heavy rainfall flooding northern vietnam situation report no2,1
3973,5647,flooding,,crabbycale oh god memories flooding back,0
3974,5650,flooding,global-nolocation,flood disaster burst water pipe floods apartments nycha senior center ny1 ny1burst water pipe floods,1
3975,5651,flooding,,lrt look tom feels flooding back,0
3976,5652,flooding,jakarta/kuala lumpur/s'pore,myanmar msf assisting thousands worst flooding decades hits parts myanmar,1
3977,5653,flooding,"ocean city, nj",residents central part ocean city heard engineers flood mitigation options tuesday ocnj,1
3978,5654,flooding,,wen finally get girl want im flooding yall wit pics us rs tho,0
3979,5655,flooding,belleville,kwislo see flooding mad decent,0
3980,5656,flooding,"kualar lumpur, malaysia",monsoon flooding kills dozens myanmar prompting calls help,1
3981,5657,flooding,"austin, tx",memorial unveiled travis county deputy killed sept flooding travis county sheriff greg hamilton joinedû,1
3982,5658,flooding,,flooding kills 166 displace one million pakistan,1
3983,5659,flooding,"nadiad ,gujarat , india!!",thankkk u soo much flooding notificationsu fella parsholics r superb amp jus soo awesomelove love u always frvrgrateful,0
3984,5661,floods,south of d.c.,slip sliding away flash floods info writers wtony nester sonoranrattler writingtips,1
3985,5662,floods,,bringing tornadoes floods bringing climate change god america plaguing farrakhan quote,1
3986,5663,floods,adventist - lesson sabbath,myanmar flooding heavy monsoon rains month july caused flooding flash floods landsli,1
3987,5664,floods,australia,india 119000 people taken shelter 966 relief camps government set floods,1
3988,5665,floods,,pmharper dont worry im sure climate nothing hail floods tornados alberta amp ontario im sure gods mad,1
3989,5668,floods,passamaquoddy,ictyosaur never thought would wtf moment yet months 90 degree heat next flash floods,1
3990,5669,floods,û¢iii.xii.mmxiû¢,granted like half town floods rains still whatever,1
3991,5670,floods,"sherwood, brisbane, australia",madonnamking rspca site multiple 7 story high rise buildings next low density character residential area floods,0
3992,5671,floods,canada,cyberdemon531 hope mountain dew erodes throat floods lungs leaving drown death,1
3993,5672,floods,michigan,disaster group stunned floods,1
3994,5673,floods,london,theres person amp reckon youre dying brain floods dmt causing relive life real time simulation,0
3995,5674,floods,,ever remembered old song something havent heared years words carry floods memories along priceless,0
3996,5675,floods,california,floods fishing finally sunshine amp fab deals albertsons anniversary sale lauren paints beautiful life,0
3997,5676,floods,global-nolocation,flood disaster bengal floods cm mamata banerjee blames dvc bjp claims state failed use economic,1
3998,5677,floods,,69 dead due floods myanmar naypyidaw aug 5 prensa latina death toll rose today 69 myanmar,1
3999,5680,floods,estados unidos,typhoon soudelor approaches 7 killed 2 missing floods philippines,1
4000,5683,floods,new jersey,casewrites rains nj flash floods otherwise desert grief taxes,1
4001,5684,floods,"new york, ny",download itunes,0
4002,5685,floods,"timaru district, new zealand",contactenergy yep floods 1999 2000 clyde dam releasing every bit water could speccy ev charging way,1
4003,5686,floods,cameroon,bamenda floods kill animals birds,1
4004,5687,floods,"st austell, cornwall",hope rains throughout whole weekend hope floods portaloos become sentient,0
4005,5688,floods,"ogba, lagos, nigeria",apc chieftain tasks dickson n15b floods donation bayelsa,1
4006,5689,floods,philippines,pagasa 712am yellow warning panay island guimaras negros possible floods lowlying areas amp landslides mountainous areas,1
4007,5690,floods,,rt 40hourfamine bangladesh government declared floods emergency worldvision continue mû,1
4008,5692,floods,north america,nearly 50 thousand people affected floods paraguay,1
4009,5693,floods,earth,etp bengal floods cm mamata banerjee blames dvc bjp claims state failed use relief funds even flood w,1
4010,5694,floods,,may allah help suffering pakistan floods families dua,1
4011,5695,floods,,children myanmar face double catastrophe floods hit,1
4012,5698,floods,"new york, usa",love drake floods instagram makes feel real tune everything like sumn,0
4013,5699,floods,,bringing tornadoes floods bringing climate change god america plaguing farrakhan quote,0
4014,5703,floods,,69 die myanmar floods 250000 affected,1
4015,5704,floods,,typhoon soudelor approaches 7 killed 2 missing floods philippinesû,1
4016,5705,floods,,memphis always floods,1
4017,5706,floods,"21.462446,-158.022017",floods cause damage death across asia media content,1
4018,5707,floods,rio de janeiro,gtas soon maintenance ends everyone floods servers gtservers destroyed extreme load gtmaintenance starts anew,0
4019,5710,floods,,bringing tornadoes floods bringing climate change god america plaguing farrakhan quote,0
4020,5711,forest fire,,e112 particulatebreak solid combust fossil fuel voltaic active forest fire biological vocpetroleum ch4 bacteria decomposition,1
4021,5712,forest fire,pdx,careful anyone lives west beaverton forest grove rapidly spreading fire heading east,1
4022,5713,forest fire,shelby county,added video youtube playlist,1
4023,5714,forest fire,,one careless match start forest fire takes whole box start campfire,1
4024,5715,forest fire,port matilda pa,little forest fire wardens,1
4025,5716,forest fire,"concord, n.c.",fire pisgah national forest grows 375 acres,1
4026,5717,forest fire,"redding, california, usa",ashenforest floorburnt manzanita amp timber johnson fire along ridge forest road 1 routecomplex,1
4027,5719,forest fire,,sweet2young runs setting forest fire bites shit neck,1
4028,5720,forest fire,,hornybigbadwolf sets forest fire,1
4029,5721,forest fire,"slatina,romania",liked youtube video,0
4030,5722,forest fire,"redding, california, usa",view smoke column rising south end blake fire along forest road 1 routecomplex,1
4031,5724,forest fire,,starts forest fire cannot put,1
4032,5726,forest fire,"asheville, nc",fire pisgah national forest grows 375 acres,1
4033,5727,forest fire,,grill school function one grills going pretty much either forest fire inbetween made work,0
4034,5729,forest fire,,515p watch forest fire smoke lifted nuff fme tmake run tthe pet store hwy n ill bhome 7p,1
4035,5730,forest fire,los angeles for now,forest fires socal fire watch ybtheprophet realhiphop,1
4036,5732,forest fire,????????????,us forest service firefighter david ruhl 38 died frog fire modoc national forest temporarily reassigned,1
4037,5733,forest fire,western washington,usfs acronym united states fire service,0
4038,5734,forest fire,atlanta,one careless match start forest fire takes whole box start campfire,0
4039,5736,forest fires,,prevent forest fires,1
4040,5739,forest fires,,naturaldisasters california fires rage forest service sounds alarm rising wildfire costs û,1
4041,5740,forest fires,,q ducks big flat feet stamp forest fires q elephants big flat feet stamp flaming ducks,0
4042,5741,forest fires,"alberta, canada",gilmanrocks7 wow rest summer usually worry forest fires calgary 8 hours away,1
4043,5743,forest fires,"washington, d.c.",california fires rage forest service sounds alarm sharply rising wildfire costs,1
4044,5744,forest fires,,little concerned number forest fires ill living,1
4045,5745,forest fires,,nycdivorcelaw trump climate denier algae bloom pacific calif alska seeweed caribean forest fires snowball inhofe,1
4046,5746,forest fires,montana ,forest service spends gt50 budget fighting fires,1
4047,5748,forest fires,,cartoon bears without would qave knowlddge forest fires toilet paper,0
4048,5751,forest fires,,first year forest service spent half annual budget fighting fires climatechange,1
4049,5752,forest fires,,california fires rage forest service sounds alarm rising wildfire costs,1
4050,5753,forest fires,,reddit,1
4051,5754,forest fires,san francisco,spread conflict palmoil sparked increase fires destroying forest throughout indonesia,1
4052,5757,forest fires,cape cod,photo blue forestfires source,1
4053,5758,forest fires,,im cook smokey bear saving forest fires face ass,0
4054,5759,forest fires,nicola valley,forest fires amp dying salmon time 2 act deny climate change nightmares,1
4055,5760,forest fires,tips on my blog at,tales trees deep water loving lake tahoe forest fires,0
4056,5763,forest fires,"boise, idaho",852015 430 pm progress made boise forest fires,1
4057,5764,forest fires,,group florida forest service firefighters could deployed california help contain fires details 10,1
4058,5765,forest fires,,pray east coast forest fires pray put pray rain,1
4059,5766,forest fires,duncan,bluejays braves angels instead dumping water please send british columbia help forest fires,1
4060,5769,forest fires,,heartdisease us forest service says spending half budget fires,1
4061,5771,forest fires,texas ,pharrell prevent forest fires,0
4062,5772,forest fires,,climate consequences us forest service says spending half budget fires,1
4063,5775,forest fires,,us forest service says spending half budget fires,1
4064,5776,forest fires,based in ca - serve nationwide,property losses northern california wildfire nearly double,1
