,id,keyword,location,text,target
5399,7702,panicking,?,hear mumbling hear cackling got em scared shook panicking,0
5400,7703,panicking,singapore,made mood go shitty af panicking af istg,0
5401,7707,panicking,oxford / bristol,okay panicking,0
5402,7711,panicking,parachute,idm burn whole gotham city bcs im gonna laugh everyone theyre panicking,0
5403,7712,panicking,near warrington,certainly ianbartlett great see hs2 astroturfers panicking thought cross party support crumbling,0
5404,7714,panicking,,new post people finally panicking cable tv,0
5405,7715,panicking,|-/,1130 im already panicking crying bc im stressed nice,0
5406,7717,panicking,,people finally panicking cable tv,0
5407,7718,panicking,pawnee,adumbbb oh thats bad haha wouldve panicking tho,0
5408,7719,panicking,,beauscoven nah man hes panicking found brothers wife debbie hospital hes stressed,0
5409,7720,panicking,"melbourne, victoria",panicking maybe bff left china bar maybe tindering toilet 20mins,0
5410,7721,panicking,uk,ushiocomics may panicking little wasnt fast submitting form usually,0
5411,7722,panicking,,panicking made tired want sleep bed,1
5412,7723,panicking,manchester,yet brits panicking uk,0
5413,7724,panicking,georgia,scared screaming panicking redeemer,0
5414,7725,panicking,uk,dad panicking weight loss means needs hurry new clothes fundwhen reach goal,0
5415,7727,panicking,,already panicking school starting,0
5416,7728,panicking,"derbyshire, united kingdom",people finally panicking cable tv,0
5417,7731,panicking,,feel like panicking idk get results back week im alarmingly calm,0
5418,7733,panicking,vcu,realized maybe normal sit front uber driver panicking,0
5419,7735,panicking,"mclean, va",cpinto001 see people panicking orpik,0
5420,7736,panicking,,ay fully panicking lol,0
5421,7737,panicking,,lets drive truck start panicking flip bitch,0
5422,7738,panicking,,jeannathomas gonna lie im panicking little bit vichardy freeman practicing,0
5423,7739,panicking,south florida,people finally panicking cable tv,0
5424,7742,panicking,,stop panicking ogtomd,0
5425,7743,panicking,positive 852,sis sit cam wo panicking,0
5426,7744,panicking,"manchester, england",people panicking results day though hahahah like worrying going change results,0
5427,7746,police,san francisco,america said war terrorism police took ar15 ready start shooting enemies,1
5428,7747,police,"kansas city, mo.",police gunman reported dead nashville area theater suspect carried gun hatchet carmi,1
5429,7748,police,"new york, ny",breaking411 4 police officers arrested abusing children policerun boot camp san luis obispo calif,1
5430,7749,police,,fucking police cant touch fuck niggas aint fucking w,0
5431,7750,police,,world news qld police wrap billy gordon investigation queensland police wrapped investigation,1
5432,7751,police,,gunman opened fire tennessee movie theater killed police anyone suspect suicidebycop,1
5433,7752,police,indonesia,police kill hatchetwielding gunman opened fire inside nashville movie theater aåêmiddleaged manåêarmed wi,1
5434,7753,police,,police unions retard justice amp drain gov cops vote 4 rs rs go teachers unions instead dccc vj44 lawrence jbouie mmfa,0
5435,7754,police,,maid charged stealing dh30000 police officer sponsor,0
5436,7755,police,"massachusetts, usa",santa ana police union blocks video raid sky high holistic pot dispensary atlantic,1
5437,7756,police,"anzio,italy",4 police officers arrested abusing children policerun boot camp san luis obispo calif abc7,1
5438,7758,police,,vinnie jones goes beat northumbria police,0
5439,7759,police,nigeria,trending nigeria police charge traditional ruler others informantûªs murder,1
5440,7760,police,"us, pa",california police officer pulls gun man without apparent provocation video,1
5441,7761,police,,police expand search missing pregnant woman beloeil police richelieusaintlaurent expanding th,0
5442,7763,police,h+l,good police taking care also extra security harrybecareful,0
5443,7764,police,republic of texas,bayonets distributed local police departments randpaul wants know,0
5444,7765,police,"portland, or",unwanted person 200 block se 12th ave portland portland police pp15000266818 1710 pdx911,0
5445,7766,police,florida,episcopal priests road trip interracial family shares harrowing story police harassment,0
5446,7767,police,,oops bounty hunters try raid phoenix police chiefs home,1
5447,7768,police,usa,1 million bail man accused shooting fife police aug 5 816 pm et,1
5448,7769,police,uk,dt georgegalloway rt galloway4mayor ûïthe col police catch pickpocket liverpool stree,1
5449,7771,police,socal,brandonmulcahy fpine heres story,0
5450,7772,police,"bangalore, india",police kill gunman nashville movie theatre times india times india police killû,1
5451,7773,police,indonesia,oops bounty hunters try raid phoenix police chiefs home,0
5452,7774,police,,robbiewilliams u fkn asswipe playing israeli child killers fkn karma police get u,1
5453,7775,police,"milwaukee, wi",new technology designed help prevent dangerous police chases effort reduce injuries milwaukee policeû,0
5454,7780,police,"mesa, az",arizonadot price rd north bound closed university rio salado lots police whats crackin,1
5455,7781,police,"stratford, ct",selection september bridgeport men charged home invasion police looking burglar,1
5456,7783,police,,police walk blowin smoke dey face wanna lock cus got dope shit gay,0
5457,7784,police,,police man killed ex grandmother son wasnamp8217t named,1
5458,7785,police,,0 photo lastma officials challenge police driving traffic lagos,1
5459,7787,police,"mi,usa",helpme friend ticketed police wayne county michigan never sending poverty cycle help,0
5460,7788,police,toronto,3 options fix facebook cover violation,0
5461,7789,police,houston ,cnn tennessee movie theater shooting suspect killed police,1
5462,7790,police,indonesia,oops bounty hunters try raid phoenix police chiefs home group armed bounty hunters surrounded h,1
5463,7793,police,los angeles ,slosheriff 2 south gate police officers 2 huntington park officers arrested child abuse investigation boot camp,0
5464,7797,quarantine,missouri usa,reddit quarantineû,1
5465,7799,quarantine,pa,reddit quarantine offensive content,0
5466,7800,quarantine,south africa,reddit quarantine offensive content,0
5467,7801,quarantine,bucharest,reddit updates content policy promises quarantine û÷extremely offensiveûª communities,1
5468,7802,quarantine,,reddit updates content policy promises quarantine û÷extremely offensiveûª communities,0
5469,7803,quarantine,"mumbai, maharashtra",rt skanndtyagi wired reddit quarantine offensive content,0
5470,7804,quarantine,"joshua tree, ca",reddit quarantine offensive content,1
5471,7807,quarantine,area 8 ,update still havent eaten since 630 still clean dry lot fill water quarantine may pass,0
5472,7809,quarantine,,check reddit quarantine offensive content,0
5473,7810,quarantine,"bangalore, india",bangalore reddit updates content policy promises quarantine extremely offensive communities,0
5474,7812,quarantine,,reddit updates content policy promises quarantine û÷extremely offensiveûª communities,0
5475,7813,quarantine,"ìït: 40.707762,-74.014213",aannnnd reddit quarantine offensive content,0
5476,7815,quarantine,,reddit quarantine offensive content,0
5477,7816,quarantine,,reddit quarantine offensiveåêcontent,1
5478,7817,quarantine,mumbai,hermancranston wired reddit quarantine offensive content,0
5479,7818,quarantine,"killa hill, co",reddit quarantine offensive content reddit cofounder ceo steve huffman unveiled specif,0
5480,7821,quarantine,southern califorina,reddit quarantine offensive content reddit cofounder ceo steve huffman unveiled specif,0
5481,7822,quarantine,all over the world,wired business reddit quarantine offensive content,0
5482,7823,quarantine,"san diego, calif.",rt wired reddit quarantine offensive content,0
5483,7824,quarantine,,reddit quarantine offensive content,0
5484,7826,quarantine,geneva. and beyond. ,wired reddit quarantine offensive content reddit cofounder ceo steve huffman unveiled sp,0
5485,7827,quarantine,,missambear tweet quoted wired,0
5486,7828,quarantine,,yet another company trying censor internet reddit started quarantine content,0
5487,7830,quarantine,"nyc, new york",reddit quarantine offensive content reddit cofounder ceo steve huffman unveiled specif,0
5488,7831,quarantine,usa,reddit quarantine offensiveû,0
5489,7832,quarantine,vì_a lìáctea,reddit quarantine offensive content reddit cofounder ceo steve huffman unveiled specif,0
5490,7833,quarantine,"new york, united states",reddit quarantine offensive content,0
5491,7835,quarantine,,reddit quarantine offensive content,0
5492,7837,quarantine,,reddit quarantine offensiveåêcontent,0
5493,7839,quarantine,london,reddit updates content policy promises quarantine û÷extremely offensiveûª communities,0
5494,7840,quarantine,"san diego, ca",loved chicago much game pink eye sit design quarantine dark,0
5495,7842,quarantine,some where in this world,reddit quarantine offensive content,0
5496,7843,quarantine,,reddit quarantine offensiveåêcontent,0
5497,7844,quarantine,,reddit quarantine offensive content,1
5498,7847,quarantined,,top link reddits new content policy goes effect many horrible subreddits banned quarantined,0
5499,7848,quarantined,,quarantined little corner bc sick office work piling need kinda day,0
5500,7849,quarantined,"cumming, ga",reddits new content policy goes effect many horrible subreddits banned quarantined,0
5501,7850,quarantined,korea,top link reddits new content policy goes effect many horrible subreddits banned quarantined,0
5502,7851,quarantined,south africa,hot reddits new content policy goes effect many horrible subreddits banned quarantined,0
5503,7852,quarantined,san francisco,officials alabama home quarantined possible ebola case,1
5504,7854,quarantined,russia,hot reddits new content policy goes effect many horrible subreddits banned quarantined,0
5505,7855,quarantined,california,reddits new content policy goes effect many horrible subreddits banned quarantined,0
5506,7857,quarantined,,go ebola run lives aaarrrgghhh,1
5507,7860,quarantined,"sarasota, fl",reddits new content policy goes effect many horrible subreddits banned quarantined,1
5508,7861,quarantined,,fucking yes rantipozi quarantined triggered cucks,0
5509,7862,quarantined,melbourne,hot reddits new content policy goes effect many horrible subreddits banned quarantined,1
5510,7863,quarantined,"livonia, mi",reddits new content policy goes effect many horrible subreddits banned quarantined,0
5511,7864,quarantined,,users sub quarantined,0
5512,7865,quarantined,,officials alabama home quarantined possible,1
5513,7867,quarantined,usa,scrambledeggs calling kia gets banned quarantined months end,0
5514,7868,quarantined,"karolinska vì_gen 18, solna",officials say quarantine place birmingham home possible ebola case edward khan,1
5515,7869,quarantined,,gmtty mhtw4fnet officials alabama home quarantined possible ebola case washington times,1
5516,7870,quarantined,,top link reddits new content policy goes effect many horrible subreddits banned quarantined,0
5517,7871,quarantined,,reddits new content policy goes effect many horrible subreddits banned quarantined,0
5518,7872,quarantined,china,top link reddits new content policy goes effect many horrible subreddits banned quarantined,0
5519,7873,quarantined,,alabama home quarantined possible ebola case officials say quarantine place,1
5520,7874,quarantined,i heard #2mbikers,hm mt ebolatrends alabama home quarantined possible ebola case,1
5521,7876,quarantined,,im going say new reddit policy changes think rconspiracy quarantined thats bad truth mû,0
5522,7877,quarantined,"dunwoody, ga",okay cat quarantined bathroomits meowing really loud turned tv louderthings might work okay,0
5523,7878,quarantined,,alabama firefighters quarantined possible ebola exposure,1
5524,7880,quarantined,,0npzp mhtw4fnet officials alabama home quarantined possible ebola case abc news,1
5525,7881,quarantined,ebola,alabama home quarantined possible ebola case ambulance sat outside university alabama atû,1
5526,7882,quarantined,mongolia,hot reddits new content policy goes effect many horrible subreddits banned quarantined,0
5527,7883,quarantined,,reddits new content policy goes effect many horrible subreddits banned quarantined,0
5528,7885,quarantined,"broadview heights, ohio",hey reddit concept quarantine makes sense people youve quarantined wander amp whenever want,0
5529,7887,quarantined,,ebola alabama home quarantined possible ebola case related articles,1
5530,7888,quarantined,,oc73x mhtw4fnet officials alabama home quarantined possible ebola case washington post,1
5531,7889,quarantined,china,top link reddits new content policy goes effect many horrible subreddits banned quarantined,0
5532,7891,quarantined,"poplar, london",cant dl patch fix error symantec quarantined computer ergo stopped wireless exchange lol technology,0
5533,7893,quarantined,rome,top link reddits new content policy goes effect many horrible subreddits banned quarantined,0
5534,7894,quarantined,china,hot reddits new content policy goes effect many horrible subreddits banned quarantined,0
5535,7895,radiation emergency,"lp, mn usa",,0
5536,7897,radiation emergency,,liked youtube video,1
5537,7898,radiation emergency,,wipp emergency activated slightly elevated levels radiation sejorg,1
5538,7902,radiation emergency,"burlington, vt",worst radiation exposure fukushima meltdown happened 47km northwestproof small emergency planning zones donûªt cut,1
5539,7903,radiation emergency,"la grange park, il",wipp facility nm investigating site filter radiation reading activated emergency ops center says offsite release,0
5540,7905,radiation emergency,warszawa,radioactive box quarantined israelûªs ashdod port evacuated emergency teams discovered radiation emittin,1
5541,7906,radiation emergency,"washington, dc",radiation emergency preparedness starts knowing get inside stay inside stay tuned,1
5542,7907,radiation emergency,,else wants documents radiation emergency procedures 06 24 09 radiation emergency procedures 06 24 09,0
5543,7908,radiation emergency,#maygodhelpus,ccot tcot radiation nuclear emergency tracking center,0
5544,7909,rainstorm,"darnley, prince edward island",due rainstorm last night cupcake decorating happening rec hall 2 proceeds iwk,0
5545,7910,rainstorm,"gloucester, ma",rainstorm downtown gloucester gloucester capeann seagulls triciaoneill triciaoneillphoto,1
5546,7912,rainstorm,vancouver usa,myrtlegroggins ltgaspgt forgot sunday omg,0
5547,7913,rainstorm,alberta ,wow beauty lies within every storm taken today rainstorm aampb pipeliners,1
5548,7914,rainstorm,yobe state,rainstorm destroys 600 houses yobe state rainstorm destroys 600 houses yobe state daily trust damatu,1
5549,7915,rainstorm,"coventry, rhode island",going beach jim alves means guaranteed rainstorm lucky,0
5550,7916,rainstorm,,dnb newrelease edge jimmy summer rainstorm lapaka sounds,0
5551,7918,rainstorm,united states of america,three people killed severe rainstorm italian alps caused landslide,1
5552,7923,rainstorm,,landslide italian alps kills three rome reuters three people killed severe rainstorm th,1
5553,7924,rainstorm,federal capital territory,rainstorm destroys 600 houses yobe ireporter,1
5554,7926,rainstorm,"la puente, ca",stuck rainstorm stay toward middle road streets crowned water tends pool sides,0
5555,7929,rainstorm,music.,major rainstorm happening im gonna lie drift away storming around little bebacksoon,1
5556,7930,rainstorm,online ,landslide italian alps kills three rome reuters three people killed severe rainstorm,1
5557,7932,rainstorm,"memphis, tn",cant roar waves rainstorm amp rollingû,0
5558,7933,rainstorm,,robotrainstorm two vacancies castle fantasy football team join us itûªs fun,0
5559,7934,rainstorm,,calum5sos look like got caught rainstorm amazing disgusting time,0
5560,7935,rainstorm,,rainstorm update north south,1
5561,7936,rainstorm,thailand malaysia indonesia ,nigeria rainstorm destroys 600 houses yobe state daily trust damaturu 600û,1
5562,7937,rainstorm,earth,landslide italian alps kills three rome reuters three people killed severe rainstorm th,1
5563,7938,rainstorm,"pennsylvania, usa",rain rain go away soaker way gt,0
5564,7939,rainstorm,vancouver usa,nathanfillion hardly,0
5565,7940,rainstorm,"fairfax, va",tomorrows evening commute receives red light rainstorm impacting region push way late evening,1
5566,7941,rainstorm,"memphis, tn",rainstorm didnt last nearly long enough,1
5567,7943,rainstorm,seattle,robotrainstorm imsort interested fonts theyre using,0
5568,7944,rainstorm,"sicamous, british columbia",lizzie363 cstsmith drove thru deep water flash floodrainstorm repair cost 14000 25 yrs later people still thnk cars float,1
5569,7945,rainstorm,north memphis/global citizen,best believe wrong decisions made memphis streets rainstorm lol folk doe,0
5570,7949,rainstorm,"bridport, england",want rainstorm please,0
5571,7950,rainstorm,"porto alegre, rio grande do sul",waking sick rainstorm outside would usually make sad today though put kooks stereo lets,0
5572,7952,rainstorm,"north vancouver, bc",yay feel wind gearing rainstorm vancouver bring drought deadgrassandflowers wildfires,1
5573,7953,rainstorm,seattle,robotrainstorm im huge football fan know ive never done fantasy leagues patience newbie,0
5574,7954,rainstorm,"pioneer village, ky",way move like full rainstorm im house cards,1
5575,7955,rainstorm,"port harcourt, nigeria",rainstorm destroys 600 houses yobe state,1
5576,7957,rainstorm,ecsu16,way move like full rainstorm im house cards,0
5577,7958,rainstorm,uk,landslide caused severe rainstorm kills 3 italianåêalps,1
5578,7959,razed,,former freedom surfspa razed make way new homes,0
5579,7960,razed,,latest homes razed northern california wildfire abc news,1
5580,7962,razed,nigeria,tension abia inec officeûªs razedåêûò governor ikpeazu pdp apga react,1
5581,7963,razed,"tulsa, ok",latest homes razed northern california wildfire latest wildfires burning california andû,1
5582,7965,razed,,latest homes razed northern california wildfire,1
5583,7968,razed,,latest homes razed northern california wildfire abc news,1
5584,7969,razed,,latest homes razed northern california wildfire abc news,1
5585,7970,razed,,,1
5586,7971,razed,worldwide,news latest homes razed northern california wildfire new york times,1
5587,7972,razed,,latest homes razed northern california wildfire abc news,1
5588,7973,razed,,latest homes razed northern california wildfire abc news,1
5589,7976,razed,,latest homes razed northern california wildfire,1
5590,7977,razed,,latest homes razed northern california wildfire,1
5591,7978,razed,,latest homes razed northern california wildfire,1
5592,7980,razed,north,petereallen huffpostuk bbc5live significant think iconic pic church maybe ruins less substantial efforts razed,0
5593,7981,razed,,latest homes razed northern california wildfire,1
5594,7982,razed,,latest homes razed northern california wildfire,1
5595,7983,razed,,latest homes razed northern california wildfire abc news,1
5596,7984,razed,"ames, ia",davidvonderhaar least sincere,1
5597,7987,razed,,latest homes razed northern california wildfire abc news,1
5598,7988,razed,,latest homes razed northern california wildfire abc news,1
5599,7989,razed,,latest homes razed northern california wildfire,1
5600,7990,razed,san diego california 92101,homes razed northern calif wildfire,1
5601,7991,razed,nairobi-kenya,george njenga hero saved burning friend razing wildfire,1
5602,7992,razed,"erie, pa",today another dualcom imrazed enjoyed yesterdays check todays 5 pm easter,0
5603,7994,razed,,latest homes razed northern california wildfire abc news,1
5604,7996,razed,,latest homes razed northern california wildfire abc news,1
5605,7999,razed,,latest homes razed northern california wildfire abc news,1
5606,8000,razed,,latest homes razed northern california wildfire abc news,1
5607,8001,razed,,latest homes razed northerncalifornia wildfire,1
5608,8002,razed,,latest homes razed northern california wildfire,1
5609,8003,razed,nairobi-kenya,george njenga hero saved burning friend razing wildfire,1
5610,8005,razed,,latest homes razed northern california wildfire,1
5611,8006,razed,,latest homes razed northern california wildfire abc news,1
5612,8008,razed,"augusta, maine, 04330",vassalboro house razed make way public gazebo petelmcguire reports,0
5613,8009,refugees,,justmarried turkish couple gave 4000 syrian refugees incredible gift,1
5614,8010,refugees,ad majorem dei glorium,police monitoring 200 jihadis poland,1
5615,8012,refugees,"aurora, ontario ",turkish newlyweds donate wedding money beautiful gesture still faith humanity,0
5616,8013,refugees, baku & erzurum ,justmarried turkish couple gave 4000 syrian refugees incredible gift washingtonpost,1
5617,8015,refugees,statute of limitations_,repulsive refugeesvictimiserdutton evangelicalliarabbott co lnp dupe press overdrive choppergatebronwynbishopauspol,0
5618,8016,refugees,paradise,retweet cameroon repatriating 12000 nigerian refugees due boko haram,1
5619,8017,refugees," bc, us, asia or europe.",newlyweds feed syrian refugees wedding cbc news latest canada world entertainment business news,0
5620,8018,refugees,,wowo 12000 nigerian refugees repatriated cameroon,1
5621,8019,refugees,,hmm 12000 nigerian refugees repatriated cameroon,1
5622,8020,refugees,,whao 12000 nigerian refugees repatriated cameroon,1
5623,8021,refugees,st petersburgfl,imagine entire aisle dedicated making people look like serbian refugees director whole foods clothing section,0
5624,8023,refugees,espaì±a,viralspell couple spend wedding day feeding 4000 syrian refugees,0
5625,8024,refugees,,reaad plsss 12000 nigerian refugees repatriated cameroon,1
5626,8025,refugees,tarragona,top story viralspell couple spend wedding day feeding 4000 syrian refugeesû,0
5627,8026,refugees,,refugee connections indiegogo campaign going live tomorrow support us help launch online community refugees,1
5628,8028,refugees,,yall read 12000 nigerian refugees repatriated cameroon,1
5629,8029,refugees,,short throwing overboard dont think leader could much worse refugees tonyabbottmhr worst pm ever,1
5630,8030,refugees,warri,cameroon repatriated 12000 nigerian refugees,1
5631,8031,refugees,melbourne australia,captain abbott must go lnp boat refugees christianvalues,0
5632,8032,refugees,,turkish couple spent wedding day feeding 4000 syrian refugees turkish couple got marrie û,0
5633,8034,refugees,"21.462446,-158.022017",one couple using drones save refugees worlds deadliest border,1
5634,8035,refugees,,whao 12000 nigerian refugees repatriated cameroon,1
5635,8036,refugees,,hmm 12000 nigerian refugees repatriated cameroon,1
5636,8037,refugees,"bangalore, india",turkish couple decided feed 4000 syrian refugees part wedding celebrations,0
5637,8038,refugees,skyhold,fadelurker dalinthanelan lt right even two years still refugees camped south redcliffe village aidan gt,1
5638,8039,refugees,australia,newlyweds feed thousands syrian refugees instead hosting banquet wedding dinner,0
5639,8040,refugees,"amman,jordan",photos young refugees forced flee burundis violence vice news,1
5640,8043,refugees,tripoli international airport,kristindavis un refugees thank un refugees helping many people need world,0
5641,8044,refugees,,wowo 12000 nigerian refugees repatriated cameroon,0
5642,8045,refugees,,newlyweds feed thousands syrian refugees instead hosting banquet wedding dinner,1
5643,8047,refugees,"auckland, new zealand",,0
5644,8049,refugees,,recap 12000 nigerian refugees repatriated cameroon,1
5645,8055,refugees,"nyc,us - cali, colombia",generous bride earth couple feeds 4000 syrian refugees wedding day,0
5646,8056,refugees,,whao 12000 nigerian refugees repatriated cameroon,1
5647,8057,refugees,qld australia,46 returned refugees fleeing amp vietnamese govt treat returned dutton presser,1
5648,8058,refugees,"geneva, switzerland",chpsre rt refugees followers paris visit dream humanity exhibition rezaphotography û û,1
5649,8060,rescue,trinidad & tobago,policyholders object clico rescue plan,1
5650,8061,rescue,sf bay area,dont panik kelbytomlinson rescue,0
5651,8062,rescue,#harleychick#pjnt#runbenrun,coastal german shepherd rescue oc shared link,0
5652,8064,rescue,"toronto, ontario",ud rescue structural collapse scott road ypres road york 14 trucks,1
5653,8065,rescue,new jersey,rescue day itûªs world cat day saturday aug 8th black blackwhite cats 5,0
5654,8066,rescue,big northeast litter box,im 2 blood pressure meds still probably roof long ppact story broke involved animal rescue,0
5655,8067,rescue,sand springs oklahoma,coastal german shepherd rescue oc shared link,0
5656,8068,rescue,,coastal german shepherd rescue oc shared link ecstatic rescued racco,0
5657,8069,rescue,,suggs amp vivian rescue psychrewatch,0
5658,8070,rescue,"surry hills, sydney",lengths rescue cat need,0
5659,8071,rescue,sand springs oklahoma,last chance animal rescue 3 new posts,0
5660,8073,rescue,#harleychick#pjnt#runbenrun,last chance animal rescue 3 new posts,0
5661,8074,rescue,,sammy todd always rescue may uniform still rescue lmao forever kfc fam,0
5662,8079,rescue,usa,lunch crew made night night long day peaceloverescue,0
5663,8081,rescue,thornton  colorado,tell united nations plantations forests,0
5664,8083,rescue,wanderlust,mary coming troy rescue,0
5665,8084,rescue,"toronto, ontario",ud rescue structural collapse scott road ypres road york 14 trucks,1
5666,8085,rescue,karachi,floodzone general raheel sharif visits chitral also lauded efforts fwo army troops army aviation rescue opera,1
5667,8087,rescue,,last chance animal rescue 3 new posts,0
5668,8088,rescue,,lisavanderpump many dogs rescue dogs,0
5669,8089,rescue,india,officials rescue 367 migrants libya 25 bodies found fox news,1
